(* Generated by newm2-winapi-gen from windows_api.db — do not edit by hand. *)
DEFINITION MODULE Devices_Usb;
FROM WIN32 IMPORT BOOL, BOOLEAN, GUID, HANDLE, PWSTR;
IMPORT System_IO;

CONST
    BMREQUEST_CLASS = 1;
    BMREQUEST_DEVICE_TO_HOST = 1;
    BMREQUEST_HOST_TO_DEVICE = 0;
    BMREQUEST_STANDARD = 0;
    BMREQUEST_TO_DEVICE = 0;
    BMREQUEST_TO_ENDPOINT = 2;
    BMREQUEST_TO_INTERFACE = 1;
    BMREQUEST_TO_OTHER = 3;
    BMREQUEST_VENDOR = 2;
    BULKIN_FLAG = 128;
    DEVICE_SPEED = 1;
    EUSB2_ISOCH_ENDPOINT_COMPANION_DESCRIPTOR_TYPE = 18;
    FILE_DEVICE_USB = 34;
    FILE_DEVICE_USB_SCAN = 32768;
    FullSpeed = 2;
    HCD_DIAGNOSTIC_MODE_OFF = 257;
    HCD_DIAGNOSTIC_MODE_ON = 256;
    HCD_DISABLE_PORT = 268;
    HCD_ENABLE_PORT = 269;
    HCD_GET_DRIVERKEY_NAME = 265;
    HCD_GET_ROOT_HUB_NAME = 258;
    HCD_GET_STATS_1 = 255;
    HCD_GET_STATS_2 = 266;
    HCD_TRACE_READ_REQUEST = 275;
    HCD_USER_REQUEST = 270;
    HighSpeed = 3;
    IOCTL_ABORT_PIPE = 2147491844;
    IOCTL_CANCEL_IO = 2147491844;
    IOCTL_GENERICUSBFN_ACTIVATE_USB_BUS = 2277420;
    IOCTL_GENERICUSBFN_BUS_EVENT_NOTIFICATION = 2277430;
    IOCTL_GENERICUSBFN_CONTROL_STATUS_HANDSHAKE_IN = 2277400;
    IOCTL_GENERICUSBFN_CONTROL_STATUS_HANDSHAKE_OUT = 2277404;
    IOCTL_GENERICUSBFN_DEACTIVATE_USB_BUS = 2277424;
    IOCTL_GENERICUSBFN_GET_CLASS_INFO = 2277410;
    IOCTL_GENERICUSBFN_GET_CLASS_INFO_EX = 2277434;
    IOCTL_GENERICUSBFN_GET_INTERFACE_DESCRIPTOR_SET = 2277438;
    IOCTL_GENERICUSBFN_GET_PIPE_STATE = 2277414;
    IOCTL_GENERICUSBFN_REGISTER_USB_STRING = 2277441;
    IOCTL_GENERICUSBFN_SET_PIPE_STATE = 2277417;
    IOCTL_GENERICUSBFN_TRANSFER_IN = 2277389;
    IOCTL_GENERICUSBFN_TRANSFER_IN_APPEND_ZERO_PKT = 2277393;
    IOCTL_GENERICUSBFN_TRANSFER_OUT = 2277398;
    IOCTL_GET_CHANNEL_ALIGN_RQST = 2147491860;
    IOCTL_GET_DEVICE_DESCRIPTOR = 2147491864;
    IOCTL_GET_HCD_DRIVERKEY_NAME = 2229284;
    IOCTL_GET_PIPE_CONFIGURATION = 2147491880;
    IOCTL_GET_USB_DESCRIPTOR = 2147491872;
    IOCTL_GET_VERSION = 2147491840;
    IOCTL_INDEX = 2048;
    IOCTL_INTERNAL_USB_CYCLE_PORT = 2228255;
    IOCTL_INTERNAL_USB_ENABLE_PORT = 2228247;
    IOCTL_INTERNAL_USB_FAIL_GET_STATUS_FROM_DEVICE = 2229347;
    IOCTL_INTERNAL_USB_GET_BUSGUID_INFO = 2229288;
    IOCTL_INTERNAL_USB_GET_BUS_INFO = 2229280;
    IOCTL_INTERNAL_USB_GET_CONTROLLER_NAME = 2229284;
    IOCTL_INTERNAL_USB_GET_DEVICE_CONFIG_INFO = 2229327;
    IOCTL_INTERNAL_USB_GET_DEVICE_HANDLE = 2229299;
    IOCTL_INTERNAL_USB_GET_DEVICE_HANDLE_EX = 2229303;
    IOCTL_INTERNAL_USB_GET_HUB_COUNT = 2228251;
    IOCTL_INTERNAL_USB_GET_HUB_NAME = 2228256;
    IOCTL_INTERNAL_USB_GET_PARENT_HUB_INFO = 2229292;
    IOCTL_INTERNAL_USB_GET_PORT_STATUS = 2228243;
    IOCTL_INTERNAL_USB_GET_ROOTHUB_PDO = 2228239;
    IOCTL_INTERNAL_USB_GET_TOPOLOGY_ADDRESS = 2229311;
    IOCTL_INTERNAL_USB_GET_TT_DEVICE_HANDLE = 2229307;
    IOCTL_INTERNAL_USB_NOTIFY_IDLE_READY = 2229315;
    IOCTL_INTERNAL_USB_RECORD_FAILURE = 2228267;
    IOCTL_INTERNAL_USB_REGISTER_COMPOSITE_DEVICE = 4784131;
    IOCTL_INTERNAL_USB_REQUEST_REMOTE_WAKE_NOTIFICATION = 4784139;
    IOCTL_INTERNAL_USB_REQ_GLOBAL_RESUME = 2229323;
    IOCTL_INTERNAL_USB_REQ_GLOBAL_SUSPEND = 2229319;
    IOCTL_INTERNAL_USB_RESET_PORT = 2228231;
    IOCTL_INTERNAL_USB_SUBMIT_IDLE_NOTIFICATION = 2228263;
    IOCTL_INTERNAL_USB_SUBMIT_URB = 2228227;
    IOCTL_INTERNAL_USB_UNREGISTER_COMPOSITE_DEVICE = 4784135;
    IOCTL_READ_REGISTERS = 2147491852;
    IOCTL_RESET_PIPE = 2147491868;
    IOCTL_SEND_USB_REQUEST = 2147491876;
    IOCTL_SET_TIMEOUT = 2147491884;
    IOCTL_USB4_HRD_DEBUG_READ_CONFIGURATION_SPACE = 6295980;
    IOCTL_USB_DIAGNOSTIC_MODE_OFF = 2229252;
    IOCTL_USB_DIAGNOSTIC_MODE_ON = 2229248;
    IOCTL_USB_DIAG_IGNORE_HUBS_OFF = 2229276;
    IOCTL_USB_DIAG_IGNORE_HUBS_ON = 2229272;
    IOCTL_USB_GET_DESCRIPTOR_FROM_NODE_CONNECTION = 2229264;
    IOCTL_USB_GET_DEVICE_CHARACTERISTICS = 2229376;
    IOCTL_USB_GET_FRAME_NUMBER_AND_QPC_FOR_TIME_SYNC = 2229368;
    IOCTL_USB_GET_HUB_CAPABILITIES = 2229308;
    IOCTL_USB_GET_HUB_CAPABILITIES_EX = 2229328;
    IOCTL_USB_GET_HUB_INFORMATION_EX = 2229332;
    IOCTL_USB_GET_NODE_CONNECTION_ATTRIBUTES = 2229312;
    IOCTL_USB_GET_NODE_CONNECTION_DRIVERKEY_NAME = 2229280;
    IOCTL_USB_GET_NODE_CONNECTION_INFORMATION = 2229260;
    IOCTL_USB_GET_NODE_CONNECTION_INFORMATION_EX = 2229320;
    IOCTL_USB_GET_NODE_CONNECTION_INFORMATION_EX_V2 = 2229340;
    IOCTL_USB_GET_NODE_CONNECTION_NAME = 2229268;
    IOCTL_USB_GET_NODE_CONNECTION_SUPERSPEEDPLUS_INFORMATION = 2229380;
    IOCTL_USB_GET_NODE_INFORMATION = 2229256;
    IOCTL_USB_GET_PORT_CONNECTOR_PROPERTIES = 2229336;
    IOCTL_USB_GET_ROOT_HUB_NAME = 2229256;
    IOCTL_USB_GET_TRANSPORT_CHARACTERISTICS = 2229348;
    IOCTL_USB_HCD_DISABLE_PORT = 2229296;
    IOCTL_USB_HCD_ENABLE_PORT = 2229300;
    IOCTL_USB_HCD_GET_STATS_1 = 2229244;
    IOCTL_USB_HCD_GET_STATS_2 = 2229288;
    IOCTL_USB_HUB_CYCLE_PORT = 2229316;
    IOCTL_USB_NOTIFY_ON_TRANSPORT_CHARACTERISTICS_CHANGE = 2229356;
    IOCTL_USB_REGISTER_FOR_TRANSPORT_CHARACTERISTICS_CHANGE = 2229352;
    IOCTL_USB_RESET_HUB = 2229324;
    IOCTL_USB_START_TRACKING_FOR_TIME_SYNC = 2229364;
    IOCTL_USB_STOP_TRACKING_FOR_TIME_SYNC = 2229372;
    IOCTL_USB_UNREGISTER_FOR_TRANSPORT_CHARACTERISTICS_CHANGE = 2229360;
    IOCTL_WAIT_ON_DEVICE_EVENT = 2147491848;
    IOCTL_WRITE_REGISTERS = 2147491856;
    KREGMANUSBFNENUMPATH = "\Registry\Machine\SYSTEM\CurrentControlSet\Control\ManufacturingMode\Current\USBFN\";
    KREGUSBFNENUMPATH = "\Registry\Machine\SYSTEM\CurrentControlSet\Control\USBFN\";
    LowSpeed = 1;
    MAXIMUM_USB_STRING_LENGTH = 255;
    MAX_ALTERNATE_NAME_LENGTH = 40;
    MAX_ASSOCIATION_NAME_LENGTH = 40;
    MAX_CONFIGURATION_NAME_LENGTH = 40;
    MAX_INTERFACE_NAME_LENGTH = 40;
    MAX_NUM_PIPES = 8;
    MAX_NUM_USBFN_ENDPOINTS = 15;
    MAX_SUPPORTED_CONFIGURATIONS = 12;
    MAX_USB_STRING_LENGTH = 255;
    MS_GENRE_DESCRIPTOR_INDEX = 1;
    MS_OS_FLAGS_CONTAINERID = 2;
    MS_OS_STRING_SIGNATURE = "MSFT100";
    MS_POWER_DESCRIPTOR_INDEX = 2;
    OS_STRING_DESCRIPTOR_INDEX = 238;
    PORT_LINK_STATE_COMPLIANCE_MODE = 10;
    PORT_LINK_STATE_DISABLED = 4;
    PORT_LINK_STATE_HOT_RESET = 9;
    PORT_LINK_STATE_INACTIVE = 6;
    PORT_LINK_STATE_LOOPBACK = 11;
    PORT_LINK_STATE_POLLING = 7;
    PORT_LINK_STATE_RECOVERY = 8;
    PORT_LINK_STATE_RX_DETECT = 5;
    PORT_LINK_STATE_TEST_MODE = 11;
    PORT_LINK_STATE_U0 = 0;
    PORT_LINK_STATE_U1 = 1;
    PORT_LINK_STATE_U2 = 2;
    PORT_LINK_STATE_U3 = 3;
    URB_FUNCTION_ABORT_PIPE = 2;
    URB_FUNCTION_BULK_OR_INTERRUPT_TRANSFER = 9;
    URB_FUNCTION_BULK_OR_INTERRUPT_TRANSFER_USING_CHAINED_MDL = 55;
    URB_FUNCTION_CLASS_DEVICE = 26;
    URB_FUNCTION_CLASS_ENDPOINT = 28;
    URB_FUNCTION_CLASS_INTERFACE = 27;
    URB_FUNCTION_CLASS_OTHER = 31;
    URB_FUNCTION_CLEAR_FEATURE_TO_DEVICE = 16;
    URB_FUNCTION_CLEAR_FEATURE_TO_ENDPOINT = 18;
    URB_FUNCTION_CLEAR_FEATURE_TO_INTERFACE = 17;
    URB_FUNCTION_CLEAR_FEATURE_TO_OTHER = 34;
    URB_FUNCTION_CLOSE_STATIC_STREAMS = 54;
    URB_FUNCTION_CONTROL_TRANSFER = 8;
    URB_FUNCTION_CONTROL_TRANSFER_EX = 50;
    URB_FUNCTION_GET_CONFIGURATION = 38;
    URB_FUNCTION_GET_CURRENT_FRAME_NUMBER = 7;
    URB_FUNCTION_GET_DESCRIPTOR_FROM_DEVICE = 11;
    URB_FUNCTION_GET_DESCRIPTOR_FROM_ENDPOINT = 36;
    URB_FUNCTION_GET_DESCRIPTOR_FROM_INTERFACE = 40;
    URB_FUNCTION_GET_FRAME_LENGTH = 5;
    URB_FUNCTION_GET_INTERFACE = 39;
    URB_FUNCTION_GET_ISOCH_PIPE_TRANSFER_PATH_DELAYS = 61;
    URB_FUNCTION_GET_MS_FEATURE_DESCRIPTOR = 42;
    URB_FUNCTION_GET_STATUS_FROM_DEVICE = 19;
    URB_FUNCTION_GET_STATUS_FROM_ENDPOINT = 21;
    URB_FUNCTION_GET_STATUS_FROM_INTERFACE = 20;
    URB_FUNCTION_GET_STATUS_FROM_OTHER = 33;
    URB_FUNCTION_ISOCH_TRANSFER = 10;
    URB_FUNCTION_ISOCH_TRANSFER_USING_CHAINED_MDL = 56;
    URB_FUNCTION_OPEN_STATIC_STREAMS = 53;
    URB_FUNCTION_RELEASE_FRAME_LENGTH_CONTROL = 4;
    URB_FUNCTION_RESERVED_0X0016 = 22;
    URB_FUNCTION_RESERVE_0X001D = 29;
    URB_FUNCTION_RESERVE_0X002B = 43;
    URB_FUNCTION_RESERVE_0X002C = 44;
    URB_FUNCTION_RESERVE_0X002D = 45;
    URB_FUNCTION_RESERVE_0X002E = 46;
    URB_FUNCTION_RESERVE_0X002F = 47;
    URB_FUNCTION_RESERVE_0X0033 = 51;
    URB_FUNCTION_RESERVE_0X0034 = 52;
    URB_FUNCTION_RESET_PIPE = 30;
    URB_FUNCTION_SELECT_CONFIGURATION = 0;
    URB_FUNCTION_SELECT_INTERFACE = 1;
    URB_FUNCTION_SET_DESCRIPTOR_TO_DEVICE = 12;
    URB_FUNCTION_SET_DESCRIPTOR_TO_ENDPOINT = 37;
    URB_FUNCTION_SET_DESCRIPTOR_TO_INTERFACE = 41;
    URB_FUNCTION_SET_FEATURE_TO_DEVICE = 13;
    URB_FUNCTION_SET_FEATURE_TO_ENDPOINT = 15;
    URB_FUNCTION_SET_FEATURE_TO_INTERFACE = 14;
    URB_FUNCTION_SET_FEATURE_TO_OTHER = 35;
    URB_FUNCTION_SET_FRAME_LENGTH = 6;
    URB_FUNCTION_SYNC_CLEAR_STALL = 49;
    URB_FUNCTION_SYNC_RESET_PIPE = 48;
    URB_FUNCTION_SYNC_RESET_PIPE_AND_CLEAR_STALL = 30;
    URB_FUNCTION_TAKE_FRAME_LENGTH_CONTROL = 3;
    URB_FUNCTION_VENDOR_DEVICE = 23;
    URB_FUNCTION_VENDOR_ENDPOINT = 25;
    URB_FUNCTION_VENDOR_INTERFACE = 24;
    URB_FUNCTION_VENDOR_OTHER = 32;
    URB_OPEN_STATIC_STREAMS_VERSION_100 = 256;
    UREGMANUSBFNENUMPATH = "HKEY_LOCAL_MACHINE\SYSTEM\CurrentControlSet\Control\ManufacturingMode\Current\USBFN\";
    UREGUSBFNENUMPATH = "HKEY_LOCAL_MACHINE\SYSTEM\CurrentControlSet\Control\USBFN\";
    USB4_CONFIGURATION_REGISTERS_DW_LENGTH = 60;
    USB4_HRD_DEBUG_FUNCTION_READ_CONFIGURATION_SPACE = 1131;
    USB4_HRD_DEBUG_INTERFACE_REFERENCE_STRING = "\DEBUGINTERFACE";
    USB4_MAX_DEPTH = 6;
    USBDI_VERSION = 1536;
    USBD_DEFAULT_MAXIMUM_TRANSFER_SIZE = 4294967295;
    USBD_DEFAULT_PIPE_TRANSFER = 8;
    USBD_ISO_START_FRAME_RANGE = 1024;
    USBD_PF_CHANGE_MAX_PACKET = 1;
    USBD_PF_ENABLE_RT_THREAD_ACCESS = 4;
    USBD_PF_HANDLES_SSP_HIGH_BANDWIDTH_ISOCH = 256;
    USBD_PF_INTERACTIVE_PRIORITY = 48;
    USBD_PF_MAP_ADD_TRANSFERS = 8;
    USBD_PF_PRIORITY_MASK = 240;
    USBD_PF_SHORT_PACKET_OPT = 2;
    USBD_PF_SSP_HIGH_BANDWIDTH_ISOCH = 65536;
    USBD_PF_VIDEO_PRIORITY = 16;
    USBD_PF_VOICE_PRIORITY = 32;
    USBD_PORT_CONNECTED = 2;
    USBD_PORT_ENABLED = 1;
    USBD_SHORT_TRANSFER_OK = 2;
    USBD_START_ISO_TRANSFER_ASAP = 4;
    USBD_TRANSFER_DIRECTION = 1;
    USBD_TRANSFER_DIRECTION_IN = 1;
    USBD_TRANSFER_DIRECTION_OUT = 0;
    USBFN_INTERRUPT_ENDPOINT_SIZE_NOT_UPDATEABLE_MASK = 128;
    USBUSER_CLEAR_ROOTPORT_FEATURE = 536870918;
    USBUSER_GET_BANDWIDTH_INFORMATION = 5;
    USBUSER_GET_BUS_STATISTICS_0 = 6;
    USBUSER_GET_CONTROLLER_DRIVER_KEY = 2;
    USBUSER_GET_CONTROLLER_INFO_0 = 1;
    USBUSER_GET_POWER_STATE_MAP = 4;
    USBUSER_GET_ROOTHUB_SYMBOLIC_NAME = 7;
    USBUSER_GET_ROOTPORT_STATUS = 536870919;
    USBUSER_GET_USB2_HW_VERSION = 9;
    USBUSER_GET_USB_DRIVER_VERSION = 8;
    USBUSER_INVALID_REQUEST = 4294967280;
    USBUSER_OP_CLOSE_RAW_DEVICE = 536870915;
    USBUSER_OP_MASK_DEVONLY_API = 268435456;
    USBUSER_OP_MASK_HCTEST_API = 536870912;
    USBUSER_OP_OPEN_RAW_DEVICE = 536870914;
    USBUSER_OP_RAW_RESET_PORT = 536870913;
    USBUSER_OP_SEND_ONE_PACKET = 268435457;
    USBUSER_OP_SEND_RAW_COMMAND = 536870916;
    USBUSER_PASS_THRU = 3;
    USBUSER_SET_ROOTPORT_FEATURE = 536870917;
    USBUSER_USB_REFRESH_HCT_REG = 10;
    USBUSER_VERSION = 4;
    USB_20_ENDPOINT_TYPE_INTERRUPT_RESERVED_MASK = 252;
    USB_20_HUB_DESCRIPTOR_TYPE = 41;
    USB_30_ENDPOINT_TYPE_INTERRUPT_RESERVED_MASK = 204;
    USB_30_ENDPOINT_TYPE_INTERRUPT_USAGE_MASK = 48;
    USB_30_ENDPOINT_TYPE_INTERRUPT_USAGE_NOTIFICATION = 16;
    USB_30_ENDPOINT_TYPE_INTERRUPT_USAGE_PERIODIC = 0;
    USB_30_ENDPOINT_TYPE_INTERRUPT_USAGE_RESERVED10 = 32;
    USB_30_ENDPOINT_TYPE_INTERRUPT_USAGE_RESERVED11 = 48;
    USB_30_HUB_DESCRIPTOR_TYPE = 42;
    USB_ALLOW_FIRMWARE_UPDATE = 1;
    USB_BOS_DESCRIPTOR_TYPE = 15;
    USB_CHARGING_POLICY_DEFAULT = 0;
    USB_CHARGING_POLICY_ICCHPF = 1;
    USB_CHARGING_POLICY_ICCLPF = 2;
    USB_CHARGING_POLICY_NO_POWER = 3;
    USB_CONFIGURATION_DESCRIPTOR_TYPE = 2;
    USB_CONFIG_BUS_POWERED = 128;
    USB_CONFIG_POWERED_MASK = 192;
    USB_CONFIG_POWER_DESCRIPTOR_TYPE = 7;
    USB_CONFIG_REMOTE_WAKEUP = 32;
    USB_CONFIG_RESERVED = 31;
    USB_CONFIG_SELF_POWERED = 64;
    USB_CYCLE_PORT = 7;
    USB_DEBUG_DESCRIPTOR_TYPE = 10;
    USB_DEFAULT_DEVICE_ADDRESS = 0;
    USB_DEFAULT_ENDPOINT_ADDRESS = 0;
    USB_DEFAULT_MAX_PACKET = 64;
    USB_DEVICE_CAPABILITY_BATTERY_INFO = 7;
    USB_DEVICE_CAPABILITY_BILLBOARD = 13;
    USB_DEVICE_CAPABILITY_CONTAINER_ID = 4;
    USB_DEVICE_CAPABILITY_DESCRIPTOR_TYPE = 16;
    USB_DEVICE_CAPABILITY_FIRMWARE_STATUS = 17;
    USB_DEVICE_CAPABILITY_MAX_U1_LATENCY = 10;
    USB_DEVICE_CAPABILITY_MAX_U2_LATENCY = 2047;
    USB_DEVICE_CAPABILITY_PD_CONSUMER_PORT = 8;
    USB_DEVICE_CAPABILITY_PD_PROVIDER_PORT = 9;
    USB_DEVICE_CAPABILITY_PLATFORM = 5;
    USB_DEVICE_CAPABILITY_POWER_DELIVERY = 6;
    USB_DEVICE_CAPABILITY_PRECISION_TIME_MEASUREMENT = 11;
    USB_DEVICE_CAPABILITY_SUPERSPEEDPLUS_SPEED_DIR_RX = 0;
    USB_DEVICE_CAPABILITY_SUPERSPEEDPLUS_SPEED_DIR_TX = 1;
    USB_DEVICE_CAPABILITY_SUPERSPEEDPLUS_SPEED_LSE_BPS = 0;
    USB_DEVICE_CAPABILITY_SUPERSPEEDPLUS_SPEED_LSE_GBPS = 3;
    USB_DEVICE_CAPABILITY_SUPERSPEEDPLUS_SPEED_LSE_KBPS = 1;
    USB_DEVICE_CAPABILITY_SUPERSPEEDPLUS_SPEED_LSE_MBPS = 2;
    USB_DEVICE_CAPABILITY_SUPERSPEEDPLUS_SPEED_MODE_ASYMMETRIC = 1;
    USB_DEVICE_CAPABILITY_SUPERSPEEDPLUS_SPEED_MODE_SYMMETRIC = 0;
    USB_DEVICE_CAPABILITY_SUPERSPEEDPLUS_SPEED_PROTOCOL_SS = 0;
    USB_DEVICE_CAPABILITY_SUPERSPEEDPLUS_SPEED_PROTOCOL_SSP = 1;
    USB_DEVICE_CAPABILITY_SUPERSPEEDPLUS_USB = 10;
    USB_DEVICE_CAPABILITY_SUPERSPEED_BMATTRIBUTES_LTM_CAPABLE = 2;
    USB_DEVICE_CAPABILITY_SUPERSPEED_BMATTRIBUTES_RESERVED_MASK = 253;
    USB_DEVICE_CAPABILITY_SUPERSPEED_SPEEDS_SUPPORTED_FULL = 2;
    USB_DEVICE_CAPABILITY_SUPERSPEED_SPEEDS_SUPPORTED_HIGH = 4;
    USB_DEVICE_CAPABILITY_SUPERSPEED_SPEEDS_SUPPORTED_LOW = 1;
    USB_DEVICE_CAPABILITY_SUPERSPEED_SPEEDS_SUPPORTED_RESERVED_MASK = 65520;
    USB_DEVICE_CAPABILITY_SUPERSPEED_SPEEDS_SUPPORTED_SUPER = 8;
    USB_DEVICE_CAPABILITY_SUPERSPEED_U1_DEVICE_EXIT_MAX_VALUE = 10;
    USB_DEVICE_CAPABILITY_SUPERSPEED_U2_DEVICE_EXIT_MAX_VALUE = 2047;
    USB_DEVICE_CAPABILITY_SUPERSPEED_USB = 3;
    USB_DEVICE_CAPABILITY_USB20_EXTENSION = 2;
    USB_DEVICE_CAPABILITY_USB20_EXTENSION_BMATTRIBUTES_RESERVED_MASK = 4294901985;
    USB_DEVICE_CAPABILITY_WIRELESS_USB = 1;
    USB_DEVICE_CHARACTERISTICS_MAXIMUM_PATH_DELAYS_AVAILABLE = 1;
    USB_DEVICE_CHARACTERISTICS_VERSION_1 = 1;
    USB_DEVICE_CLASS_APPLICATION_SPECIFIC = 254;
    USB_DEVICE_CLASS_AUDIO = 1;
    USB_DEVICE_CLASS_AUDIO_VIDEO = 16;
    USB_DEVICE_CLASS_BILLBOARD = 17;
    USB_DEVICE_CLASS_CDC_DATA = 10;
    USB_DEVICE_CLASS_COMMUNICATIONS = 2;
    USB_DEVICE_CLASS_CONTENT_SECURITY = 13;
    USB_DEVICE_CLASS_DIAGNOSTIC_DEVICE = 220;
    USB_DEVICE_CLASS_HUB = 9;
    USB_DEVICE_CLASS_HUMAN_INTERFACE = 3;
    USB_DEVICE_CLASS_IMAGE = 6;
    USB_DEVICE_CLASS_MISCELLANEOUS = 239;
    USB_DEVICE_CLASS_MONITOR = 4;
    USB_DEVICE_CLASS_PERSONAL_HEALTHCARE = 15;
    USB_DEVICE_CLASS_PHYSICAL_INTERFACE = 5;
    USB_DEVICE_CLASS_POWER = 6;
    USB_DEVICE_CLASS_PRINTER = 7;
    USB_DEVICE_CLASS_RESERVED = 0;
    USB_DEVICE_CLASS_SMART_CARD = 11;
    USB_DEVICE_CLASS_STORAGE = 8;
    USB_DEVICE_CLASS_VENDOR_SPECIFIC = 255;
    USB_DEVICE_CLASS_VIDEO = 14;
    USB_DEVICE_CLASS_WIRELESS_CONTROLLER = 224;
    USB_DEVICE_DESCRIPTOR_TYPE = 1;
    USB_DEVICE_FIRMWARE_HASH_LENGTH = 32;
    USB_DEVICE_QUALIFIER_DESCRIPTOR_TYPE = 6;
    USB_DIAG_IGNORE_HUBS_OFF = 263;
    USB_DIAG_IGNORE_HUBS_ON = 262;
    USB_DISALLOW_FIRMWARE_UPDATE = 0;
    USB_ENABLE_PORT = 5;
    USB_ENDPOINT_ADDRESS_MASK = 15;
    USB_ENDPOINT_DESCRIPTOR_TYPE = 5;
    USB_ENDPOINT_DIRECTION_MASK = 128;
    USB_ENDPOINT_SUPERSPEED_BULK_MAX_PACKET_SIZE = 1024;
    USB_ENDPOINT_SUPERSPEED_CONTROL_MAX_PACKET_SIZE = 512;
    USB_ENDPOINT_SUPERSPEED_INTERRUPT_MAX_PACKET_SIZE = 1024;
    USB_ENDPOINT_SUPERSPEED_ISO_MAX_PACKET_SIZE = 1024;
    USB_ENDPOINT_TYPE_BULK = 2;
    USB_ENDPOINT_TYPE_BULK_RESERVED_MASK = 252;
    USB_ENDPOINT_TYPE_CONTROL = 0;
    USB_ENDPOINT_TYPE_CONTROL_RESERVED_MASK = 252;
    USB_ENDPOINT_TYPE_INTERRUPT = 3;
    USB_ENDPOINT_TYPE_ISOCHRONOUS = 1;
    USB_ENDPOINT_TYPE_ISOCHRONOUS_RESERVED_MASK = 192;
    USB_ENDPOINT_TYPE_ISOCHRONOUS_SYNCHRONIZATION_ADAPTIVE = 8;
    USB_ENDPOINT_TYPE_ISOCHRONOUS_SYNCHRONIZATION_ASYNCHRONOUS = 4;
    USB_ENDPOINT_TYPE_ISOCHRONOUS_SYNCHRONIZATION_MASK = 12;
    USB_ENDPOINT_TYPE_ISOCHRONOUS_SYNCHRONIZATION_NO_SYNCHRONIZATION = 0;
    USB_ENDPOINT_TYPE_ISOCHRONOUS_SYNCHRONIZATION_SYNCHRONOUS = 12;
    USB_ENDPOINT_TYPE_ISOCHRONOUS_USAGE_DATA_ENDOINT = 0;
    USB_ENDPOINT_TYPE_ISOCHRONOUS_USAGE_FEEDBACK_ENDPOINT = 16;
    USB_ENDPOINT_TYPE_ISOCHRONOUS_USAGE_IMPLICIT_FEEDBACK_DATA_ENDPOINT = 32;
    USB_ENDPOINT_TYPE_ISOCHRONOUS_USAGE_MASK = 48;
    USB_ENDPOINT_TYPE_ISOCHRONOUS_USAGE_RESERVED = 48;
    USB_ENDPOINT_TYPE_MASK = 3;
    USB_FAIL_GET_STATUS = 280;
    USB_FEATURE_BATTERY_WAKE_MASK = 40;
    USB_FEATURE_CHARGING_POLICY = 54;
    USB_FEATURE_ENDPOINT_STALL = 0;
    USB_FEATURE_FUNCTION_SUSPEND = 0;
    USB_FEATURE_INTERFACE_POWER_D0 = 2;
    USB_FEATURE_INTERFACE_POWER_D1 = 3;
    USB_FEATURE_INTERFACE_POWER_D2 = 4;
    USB_FEATURE_INTERFACE_POWER_D3 = 5;
    USB_FEATURE_LDM_ENABLE = 53;
    USB_FEATURE_LTM_ENABLE = 50;
    USB_FEATURE_OS_IS_PD_AWARE = 41;
    USB_FEATURE_POLICY_MODE = 42;
    USB_FEATURE_REMOTE_WAKEUP = 1;
    USB_FEATURE_TEST_MODE = 2;
    USB_FEATURE_U1_ENABLE = 48;
    USB_FEATURE_U2_ENABLE = 49;
    USB_GETSTATUS_LTM_ENABLE = 16;
    USB_GETSTATUS_REMOTE_WAKEUP_ENABLED = 2;
    USB_GETSTATUS_SELF_POWERED = 1;
    USB_GETSTATUS_U1_ENABLE = 4;
    USB_GETSTATUS_U2_ENABLE = 8;
    USB_GET_BUSGUID_INFO = 266;
    USB_GET_BUS_INFO = 264;
    USB_GET_CONTROLLER_NAME = 265;
    USB_GET_DESCRIPTOR_FROM_NODE_CONNECTION = 260;
    USB_GET_DEVICE_CHARACTERISTICS = 288;
    USB_GET_DEVICE_HANDLE = 268;
    USB_GET_DEVICE_HANDLE_EX = 269;
    USB_GET_FIRMWARE_ALLOWED_OR_DISALLOWED_STATE = 0;
    USB_GET_FIRMWARE_HASH = 1;
    USB_GET_FRAME_NUMBER_AND_QPC_FOR_TIME_SYNC = 286;
    USB_GET_HUB_CAPABILITIES = 271;
    USB_GET_HUB_CAPABILITIES_EX = 276;
    USB_GET_HUB_CONFIG_INFO = 275;
    USB_GET_HUB_COUNT = 6;
    USB_GET_HUB_INFORMATION_EX = 277;
    USB_GET_HUB_NAME = 8;
    USB_GET_NODE_CONNECTION_ATTRIBUTES = 272;
    USB_GET_NODE_CONNECTION_DRIVERKEY_NAME = 264;
    USB_GET_NODE_CONNECTION_INFORMATION = 259;
    USB_GET_NODE_CONNECTION_INFORMATION_EX = 274;
    USB_GET_NODE_CONNECTION_INFORMATION_EX_V2 = 279;
    USB_GET_NODE_CONNECTION_NAME = 261;
    USB_GET_NODE_CONNECTION_SUPERSPEEDPLUS_INFORMATION = 289;
    USB_GET_NODE_INFORMATION = 258;
    USB_GET_PARENT_HUB_INFO = 267;
    USB_GET_PORT_CONNECTOR_PROPERTIES = 278;
    USB_GET_PORT_STATUS = 4;
    USB_GET_ROOTHUB_PDO = 3;
    USB_GET_TOPOLOGY_ADDRESS = 271;
    USB_GET_TRANSPORT_CHARACTERISTICS = 281;
    USB_GET_TT_DEVICE_HANDLE = 270;
    USB_HC_FEATURE_FLAG_PORT_POWER_SWITCHING = 1;
    USB_HC_FEATURE_FLAG_SEL_SUSPEND = 2;
    USB_HC_FEATURE_LEGACY_BIOS = 4;
    USB_HC_FEATURE_TIME_SYNC_API = 8;
    USB_HIGHSPEED_EUSB2_ISOCHRONOUS_MAX_BYTESPERINTERVAL = 6144;
    USB_HIGHSPEED_EUSB2_ISOCHRONOUS_MIN_BYTESPERINTERVAL = 3073;
    USB_HUB_CYCLE_PORT = 273;
    USB_IDLE_NOTIFICATION = 9;
    USB_IDLE_NOTIFICATION_EX = 272;
    USB_INTERFACE_ASSOCIATION_DESCRIPTOR_TYPE = 11;
    USB_INTERFACE_DESCRIPTOR_TYPE = 4;
    USB_INTERFACE_POWER_DESCRIPTOR_TYPE = 8;
    USB_NOTIFY_ON_TRANSPORT_CHARACTERISTICS_CHANGE = 283;
    USB_OTG_DESCRIPTOR_TYPE = 9;
    USB_OTHER_SPEED_CONFIGURATION_DESCRIPTOR_TYPE = 7;
    USB_PACKETFLAG_ASYNC_IN = 8;
    USB_PACKETFLAG_ASYNC_OUT = 16;
    USB_PACKETFLAG_FULL_SPEED = 2;
    USB_PACKETFLAG_HIGH_SPEED = 4;
    USB_PACKETFLAG_ISO_IN = 32;
    USB_PACKETFLAG_ISO_OUT = 64;
    USB_PACKETFLAG_LOW_SPEED = 1;
    USB_PACKETFLAG_SETUP = 128;
    USB_PACKETFLAG_TOGGLE0 = 256;
    USB_PACKETFLAG_TOGGLE1 = 512;
    USB_PORTATTR_MINI_CONNECTOR = 4;
    USB_PORTATTR_NO_CONNECTOR = 1;
    USB_PORTATTR_NO_OVERCURRENT_UI = 33554432;
    USB_PORTATTR_OEM_CONNECTOR = 8;
    USB_PORTATTR_OWNED_BY_CC = 16777216;
    USB_PORTATTR_SHARED_USB2 = 2;
    USB_PORT_STATUS_CONNECT = 1;
    USB_PORT_STATUS_ENABLE = 2;
    USB_PORT_STATUS_HIGH_SPEED = 1024;
    USB_PORT_STATUS_LOW_SPEED = 512;
    USB_PORT_STATUS_OVER_CURRENT = 8;
    USB_PORT_STATUS_POWER = 256;
    USB_PORT_STATUS_RESET = 16;
    USB_PORT_STATUS_SUSPEND = 4;
    USB_RECORD_FAILURE = 10;
    USB_REGISTER_COMPOSITE_DEVICE = 0;
    USB_REGISTER_FOR_TRANSPORT_BANDWIDTH_CHANGE = 2;
    USB_REGISTER_FOR_TRANSPORT_CHARACTERISTICS_CHANGE = 282;
    USB_REGISTER_FOR_TRANSPORT_LATENCY_CHANGE = 1;
    USB_REQUEST_CLEAR_FEATURE = 1;
    USB_REQUEST_CLEAR_TT_BUFFER = 8;
    USB_REQUEST_GET_CONFIGURATION = 8;
    USB_REQUEST_GET_DESCRIPTOR = 6;
    USB_REQUEST_GET_FIRMWARE_STATUS = 26;
    USB_REQUEST_GET_INTERFACE = 10;
    USB_REQUEST_GET_PORT_ERR_COUNT = 13;
    USB_REQUEST_GET_STATE = 2;
    USB_REQUEST_GET_STATUS = 0;
    USB_REQUEST_GET_TT_STATE = 10;
    USB_REQUEST_ISOCH_DELAY = 49;
    USB_REQUEST_REMOTE_WAKE_NOTIFICATION = 2;
    USB_REQUEST_RESET_TT = 9;
    USB_REQUEST_SET_ADDRESS = 5;
    USB_REQUEST_SET_CONFIGURATION = 9;
    USB_REQUEST_SET_DESCRIPTOR = 7;
    USB_REQUEST_SET_FEATURE = 3;
    USB_REQUEST_SET_FIRMWARE_STATUS = 27;
    USB_REQUEST_SET_HUB_DEPTH = 12;
    USB_REQUEST_SET_INTERFACE = 11;
    USB_REQUEST_SET_SEL = 48;
    USB_REQUEST_STOP_TT = 11;
    USB_REQUEST_SYNC_FRAME = 12;
    USB_REQ_GLOBAL_RESUME = 274;
    USB_REQ_GLOBAL_SUSPEND = 273;
    USB_RESERVED_DESCRIPTOR_TYPE = 6;
    USB_RESERVED_USER_BASE = 1024;
    USB_RESET_HUB = 275;
    USB_RESET_PORT = 1;
    USB_START_TRACKING_FOR_TIME_SYNC = 285;
    USB_STATUS_EXT_PORT_STATUS = 2;
    USB_STATUS_PD_STATUS = 1;
    USB_STATUS_PORT_STATUS = 0;
    USB_STOP_TRACKING_FOR_TIME_SYNC = 287;
    USB_STRING_DESCRIPTOR_TYPE = 3;
    USB_SUBMIT_URB = 0;
    USB_SUPERSPEEDPLUS_ISOCHRONOUS_MAX_BYTESPERINTERVAL = 16777215;
    USB_SUPERSPEEDPLUS_ISOCHRONOUS_MIN_BYTESPERINTERVAL = 49153;
    USB_SUPERSPEEDPLUS_ISOCH_ENDPOINT_COMPANION_DESCRIPTOR_TYPE = 49;
    USB_SUPERSPEED_ENDPOINT_COMPANION_DESCRIPTOR_TYPE = 48;
    USB_SUPERSPEED_ISOCHRONOUS_MAX_MULTIPLIER = 2;
    USB_SUPPORT_D0_COMMAND = 1;
    USB_SUPPORT_D1_COMMAND = 2;
    USB_SUPPORT_D1_WAKEUP = 16;
    USB_SUPPORT_D2_COMMAND = 4;
    USB_SUPPORT_D2_WAKEUP = 32;
    USB_SUPPORT_D3_COMMAND = 8;
    USB_TEST_MODE_TEST_FORCE_ENABLE = 5;
    USB_TEST_MODE_TEST_J = 1;
    USB_TEST_MODE_TEST_K = 2;
    USB_TEST_MODE_TEST_PACKET = 4;
    USB_TEST_MODE_TEST_SE0_NAK = 3;
    USB_TRANSPORT_CHARACTERISTICS_BANDWIDTH_AVAILABLE = 2;
    USB_TRANSPORT_CHARACTERISTICS_LATENCY_AVAILABLE = 1;
    USB_TRANSPORT_CHARACTERISTICS_VERSION_1 = 1;
    USB_UNREGISTER_COMPOSITE_DEVICE = 1;
    USB_UNREGISTER_FOR_TRANSPORT_CHARACTERISTICS_CHANGE = 284;
    WMI_USB_DEVICE_NODE_INFORMATION = 2;
    WMI_USB_DRIVER_INFORMATION = 0;
    WMI_USB_DRIVER_NOTIFICATION = 1;
    WMI_USB_HUB_NODE_INFORMATION = 4;
    WMI_USB_PERFORMANCE_INFORMATION = 1;
    WMI_USB_POWER_DEVICE_ENABLE = 2;
    EVENT_PIPE = 0;
    READ_DATA_PIPE = 1;
    WRITE_DATA_PIPE = 2;
    ALL_PIPE = 3;
    USBSCAN_PIPE_CONTROL = 0;
    USBSCAN_PIPE_ISOCHRONOUS = 1;
    USBSCAN_PIPE_BULK = 2;
    USBSCAN_PIPE_INTERRUPT = 3;
    USB4PathConfigurationSpace = 0;
    USB4AdapterConfigurationSpace = 1;
    USB4RouterConfigurationSpace = 2;
    USB4CounterConfigurationSpace = 3;
    ErrConn = 0;
    ErrLink = 1;
    ErrAddr = 2;
    ErrAdp = 4;
    HpAck = 7;
    ErrEnum = 8;
    ErrNua = 9;
    ErrLen = 11;
    ErrHec = 12;
    ErrFc = 13;
    ErrPlug = 14;
    ErrLock = 15;
    DpBw = 32;
    RopCmplt = 33;
    PopCmplt = 34;
    PcieWake = 35;
    DpConChange = 36;
    DpTxDiscovery = 37;
    LinkRecovery = 38;
    AsymLink = 39;
    PollingSkipped = 252;
    PollingTimeout = 253;
    StatusSuccess = 254;
    StatusUnknown = 255;
    UsbdEndpointOffloadModeNotSupported = 0;
    UsbdEndpointOffloadSoftwareAssisted = 1;
    UsbdEndpointOffloadHardwareAssisted = 2;
    UsbdPipeTypeControl = 0;
    UsbdPipeTypeIsochronous = 1;
    UsbdPipeTypeBulk = 2;
    UsbdPipeTypeInterrupt = 3;
    UsbfnBusSpeedLow = 0;
    UsbfnBusSpeedFull = 1;
    UsbfnBusSpeedHigh = 2;
    UsbfnBusSpeedSuper = 3;
    UsbfnBusSpeedMaximum = 4;
    UsbfnDeviceStateMinimum = 0;
    UsbfnDeviceStateAttached = 1;
    UsbfnDeviceStateDefault = 2;
    UsbfnDeviceStateDetached = 3;
    UsbfnDeviceStateAddressed = 4;
    UsbfnDeviceStateConfigured = 5;
    UsbfnDeviceStateSuspended = 6;
    UsbfnDeviceStateStateMaximum = 7;
    UsbfnDirectionMinimum = 0;
    UsbfnDirectionIn = 1;
    UsbfnDirectionOut = 2;
    UsbfnDirectionTx = 1;
    UsbfnDirectionRx = 2;
    UsbfnDirectionMaximum = 3;
    UsbfnEventMinimum = 0;
    UsbfnEventAttach = 1;
    UsbfnEventReset = 2;
    UsbfnEventDetach = 3;
    UsbfnEventSuspend = 4;
    UsbfnEventResume = 5;
    UsbfnEventSetupPacket = 6;
    UsbfnEventConfigured = 7;
    UsbfnEventUnConfigured = 8;
    UsbfnEventPortType = 9;
    UsbfnEventBusTearDown = 10;
    UsbfnEventSetInterface = 11;
    UsbfnEventMaximum = 12;
    UsbfnUnknownPort = 0;
    UsbfnStandardDownstreamPort = 1;
    UsbfnChargingDownstreamPort = 2;
    UsbfnDedicatedChargingPort = 3;
    UsbfnInvalidDedicatedChargingPort = 4;
    UsbfnProprietaryDedicatedChargingPort = 5;
    UsbfnPortTypeMaximum = 6;
    NoDeviceConnected = 0;
    DeviceConnected = 1;
    DeviceFailedEnumeration = 2;
    DeviceGeneralFailure = 3;
    DeviceCausedOvercurrent = 4;
    DeviceNotEnoughPower = 5;
    DeviceNotEnoughBandwidth = 6;
    DeviceHubNestedTooDeeply = 7;
    DeviceInLegacyHub = 8;
    DeviceEnumerating = 9;
    DeviceReset = 10;
    USB_HcGeneric = 0;
    OHCI_Generic = 100;
    OHCI_Hydra = 101;
    OHCI_NEC = 102;
    UHCI_Generic = 200;
    UHCI_Piix4 = 201;
    UHCI_Piix3 = 202;
    UHCI_Ich2 = 203;
    UHCI_Reserved204 = 204;
    UHCI_Ich1 = 205;
    UHCI_Ich3m = 206;
    UHCI_Ich4 = 207;
    UHCI_Ich5 = 208;
    UHCI_Ich6 = 209;
    UHCI_Intel = 249;
    UHCI_VIA = 250;
    UHCI_VIA_x01 = 251;
    UHCI_VIA_x02 = 252;
    UHCI_VIA_x03 = 253;
    UHCI_VIA_x04 = 254;
    UHCI_VIA_x0E_FIFO = 264;
    EHCI_Generic = 1000;
    EHCI_NEC = 2000;
    EHCI_Lucent = 3000;
    EHCI_NVIDIA_Tegra2 = 4000;
    EHCI_NVIDIA_Tegra3 = 4001;
    EHCI_Intel_Medfield = 5001;
    UsbLowSpeed = 0;
    UsbFullSpeed = 1;
    UsbHighSpeed = 2;
    UsbSuperSpeed = 3;
    Usb11Device = 0;
    Usb20Device = 1;
    UsbHub = 0;
    UsbMIParent = 1;
    UsbRootHub = 1;
    Usb20Hub = 2;
    Usb30Hub = 3;
    EnumerationFailure = 0;
    InsufficentBandwidth = 1;
    InsufficentPower = 2;
    OverCurrent = 3;
    ResetOvercurrent = 4;
    AcquireBusInfo = 5;
    AcquireHubName = 6;
    AcquireControllerName = 7;
    HubOvercurrent = 8;
    HubPowerChange = 9;
    HubNestedTooDeeply = 10;
    ModernDeviceInLegacyHub = 11;
    UsbUserSuccess = 0;
    UsbUserNotSupported = 1;
    UsbUserInvalidRequestCode = 2;
    UsbUserFeatureDisabled = 3;
    UsbUserInvalidHeaderParameter = 4;
    UsbUserInvalidParameter = 5;
    UsbUserMiniportError = 6;
    UsbUserBufferTooSmall = 7;
    UsbUserErrorNotMapped = 8;
    UsbUserDeviceNotStarted = 9;
    UsbUserNoDeviceConnected = 10;
    UsbDevice = 0;
    HubDevice = 1;
    CompositeDevice = 2;
    UsbController = 3;
    WdmUsbPowerNotMapped = 0;
    WdmUsbPowerSystemUnspecified = 100;
    WdmUsbPowerSystemWorking = 101;
    WdmUsbPowerSystemSleeping1 = 102;
    WdmUsbPowerSystemSleeping2 = 103;
    WdmUsbPowerSystemSleeping3 = 104;
    WdmUsbPowerSystemHibernate = 105;
    WdmUsbPowerSystemShutdown = 106;
    WdmUsbPowerDeviceUnspecified = 200;
    WdmUsbPowerDeviceD0 = 201;
    WdmUsbPowerDeviceD1 = 202;
    WdmUsbPowerDeviceD2 = 203;
    WdmUsbPowerDeviceD3 = 204;
    SHORT_PACKET_TERMINATE = 1;
    AUTO_CLEAR_STALL = 2;
    PIPE_TRANSFER_TIMEOUT = 3;
    IGNORE_SHORT_PACKETS = 4;
    ALLOW_PARTIAL_READS = 5;
    AUTO_FLUSH = 6;
    RAW_IO = 7;
    MAXIMUM_TRANSFER_SIZE = 8;
    RESET_PIPE_ON_RESUME = 9;
    AUTO_SUSPEND = 129;
    SUSPEND_DELAY = 131;

TYPE
    ALTERNATE_INTERFACE = RECORD
        InterfaceNumber : WORD;
        AlternateInterfaceNumber : WORD;
    END;
    BM_REQUEST_TYPE;
    CHANNEL_INFO = RECORD
        EventChannelSize : DWORD;
        uReadDataAlignment : DWORD;
        uWriteDataAlignment : DWORD;
    END;
    DEVICE_DESCRIPTOR = RECORD
        usVendorId : WORD;
        usProductId : WORD;
        usBcdDevice : WORD;
        usLanguageId : WORD;
    END;
    DRV_VERSION = RECORD
        major : DWORD;
        minor : DWORD;
        internal : DWORD;
    END;
    EUSB2_ISOCH_ENDPOINT_COMPANION_DESCRIPTOR = RECORD
        bLength : BYTE;
        bDescriptorType : BYTE;
        wMaxPacketSize : WORD;
        dwBytesPerInterval : DWORD;
    END;
    HCD_ISO_STAT_COUNTERS = RECORD
        LateUrbs : WORD;
        DoubleBufferedPackets : WORD;
        TransfersCF_5ms : WORD;
        TransfersCF_2ms : WORD;
        TransfersCF_1ms : WORD;
        MaxInterruptLatency : WORD;
        BadStartFrame : WORD;
        StaleUrbs : WORD;
        IsoPacketNotAccesed : WORD;
        IsoPacketHWError : WORD;
        SmallestUrbPacketCount : WORD;
        LargestUrbPacketCount : WORD;
        IsoCRC_Error : WORD;
        IsoOVERRUN_Error : WORD;
        IsoINTERNAL_Error : WORD;
        IsoUNKNOWN_Error : WORD;
        IsoBytesTransferred : DWORD;
        LateMissedCount : WORD;
        HWIsoMissedCount : WORD;
        Reserved7 : ARRAY [0..7] OF DWORD;
    END;
    HCD_STAT_COUNTERS = RECORD
        BytesTransferred : DWORD;
        IsoMissedCount : WORD;
        DataOverrunErrorCount : WORD;
        CrcErrorCount : WORD;
        ScheduleOverrunCount : WORD;
        TimeoutErrorCount : WORD;
        InternalHcErrorCount : WORD;
        BufferOverrunErrorCount : WORD;
        SWErrorCount : WORD;
        StallPidCount : WORD;
        PortDisableCount : WORD;
    END;
    HCD_STAT_INFORMATION_1 = RECORD
        Reserved1 : DWORD;
        Reserved2 : DWORD;
        ResetCounters : DWORD;
        TimeRead : INTEGER64;
        Counters : HCD_STAT_COUNTERS;
    END;
    HCD_STAT_INFORMATION_2 = RECORD
        Reserved1 : DWORD;
        Reserved2 : DWORD;
        ResetCounters : DWORD;
        TimeRead : INTEGER64;
        LockedMemoryUsed : INTEGER32;
        Counters : HCD_STAT_COUNTERS;
        IsoCounters : HCD_ISO_STAT_COUNTERS;
    END;
    HUB_DEVICE_CONFIG_INFO = RECORD
        Version : DWORD;
        Length : DWORD;
        HubFlags : USB_HUB_CAP_FLAGS;
        HardwareIds : USB_ID_STRING;
        CompatibleIds : USB_ID_STRING;
        DeviceDescription : USB_ID_STRING;
        Reserved : ARRAY [0..19] OF DWORD;
        UxdSettings : USB_HUB_DEVICE_UXD_SETTINGS;
    END;
    IO_BLOCK = RECORD
        uOffset : DWORD;
        uLength : DWORD;
        pbyData : POINTER TO BYTE;
        uIndex : DWORD;
    END;
    IO_BLOCK_EX = RECORD
        uOffset : DWORD;
        uLength : DWORD;
        pbyData : POINTER TO BYTE;
        uIndex : DWORD;
        bRequest : BYTE;
        bmRequestType : BYTE;
        fTransferDirectionIn : BYTE;
    END;
    OS_STRING = RECORD
        bLength : BYTE;
        bDescriptorType : BYTE;
        MicrosoftString : ARRAY [0..6] OF CHAR;
        bVendorCode : BYTE;
        Anonymous : ADDRESS;
    END;
    PACKET_PARAMETERS = RECORD
        DeviceAddress : BYTE;
        EndpointAddress : BYTE;
        MaximumPacketSize : WORD;
        Timeout : DWORD;
        Flags : DWORD;
        DataLength : DWORD;
        HubDeviceAddress : WORD;
        PortTTNumber : WORD;
        ErrorCount : BYTE;
        Pad : ARRAY [0..2] OF BYTE;
        UsbdStatusCode : INTEGER32;
        Data : ARRAY [0..3] OF BYTE;
    END;
    RAW_RESET_PORT_PARAMETERS = RECORD
        PortNumber : WORD;
        PortStatus : WORD;
    END;
    RAW_ROOTPORT_FEATURE = RECORD
        PortNumber : WORD;
        PortFeature : WORD;
        PortStatus : WORD;
    END;
    RAW_ROOTPORT_PARAMETERS = RECORD
        PortNumber : WORD;
        PortStatus : WORD;
    END;
    URB = RECORD
        Anonymous : ADDRESS;
    END;
    USB4_HRD_DEBUG_READ_CONFIGURATION_SPACE_INPUT = RECORD
        Route : USB4_HRD_DEBUG_ROUTE_STRING;
        AdapterNumber : BYTE;
        ConfigurationSpaceType : INTEGER32;
        DwOffset : DWORD;
        DwLength : DWORD;
    END;
    USB4_HRD_DEBUG_READ_CONFIGURATION_SPACE_OUTPUT = RECORD
        Usb4Status : INTEGER32;
        Data : ARRAY [0..59] OF DWORD;
    END;
    USB4_HRD_DEBUG_ROUTE_STRING = RECORD
        Depth : BYTE;
        Route : ARRAY [0..6] OF BYTE;
    END;
    USBD_DEVICE_INFORMATION = RECORD
        OffsetNext : DWORD;
        UsbdDeviceHandle : ADDRESS;
        DeviceDescriptor : USB_DEVICE_DESCRIPTOR;
    END;
    USBD_ENDPOINT_OFFLOAD_INFORMATION = RECORD
        Size : DWORD;
        EndpointAddress : WORD;
        ResourceId : DWORD;
        Mode : INTEGER32;
        _bitfield1 : DWORD;
        _bitfield2 : DWORD;
        TransferSegmentLA : INTEGER64;
        TransferSegmentVA : ADDRESS;
        TransferRingSize : ADRCARD;
        TransferRingInitialCycleBit : DWORD;
        MessageNumber : DWORD;
        EventRingSegmentLA : INTEGER64;
        EventRingSegmentVA : ADDRESS;
        EventRingSize : ADRCARD;
        EventRingInitialCycleBit : DWORD;
        ClientTransferRingSegmentPAIn : INTEGER64;
        ClientTransferRingSizeIn : ADRCARD;
        ClientDataBufferPAIn : INTEGER64;
        ClientDataBufferSizeIn : ADRCARD;
        ClientDataBufferLAOut : INTEGER64;
        ClientDataBufferVAOut : ADDRESS;
    END;
    USBD_ENDPOINT_OFFLOAD_INFORMATION_V1 = RECORD
        Size : DWORD;
        EndpointAddress : WORD;
        ResourceId : DWORD;
        Mode : INTEGER32;
        _bitfield1 : DWORD;
        _bitfield2 : DWORD;
        TransferSegmentLA : INTEGER64;
        TransferSegmentVA : ADDRESS;
        TransferRingSize : ADRCARD;
        TransferRingInitialCycleBit : DWORD;
        MessageNumber : DWORD;
        EventRingSegmentLA : INTEGER64;
        EventRingSegmentVA : ADDRESS;
        EventRingSize : ADRCARD;
        EventRingInitialCycleBit : DWORD;
    END;
    USBD_INTERFACE_INFORMATION = RECORD
        Length : WORD;
        InterfaceNumber : BYTE;
        AlternateSetting : BYTE;
        Class : BYTE;
        SubClass : BYTE;
        Protocol : BYTE;
        Reserved : BYTE;
        InterfaceHandle : ADDRESS;
        NumberOfPipes : DWORD;
        Pipes : ARRAY [0..23] OF BYTE;
    END;
    USBD_ISO_PACKET_DESCRIPTOR = RECORD
        Offset : DWORD;
        Length : DWORD;
        Status : INTEGER32;
    END;
    USBD_PIPE_INFORMATION = RECORD
        MaximumPacketSize : WORD;
        EndpointAddress : BYTE;
        Interval : BYTE;
        PipeType : INTEGER32;
        PipeHandle : ADDRESS;
        MaximumTransferSize : DWORD;
        PipeFlags : DWORD;
    END;
    USBD_STREAM_INFORMATION = RECORD
        PipeHandle : ADDRESS;
        StreamID : DWORD;
        MaximumTransferSize : DWORD;
        PipeFlags : DWORD;
    END;
    USBD_VERSION_INFORMATION = RECORD
        USBDI_Version : DWORD;
        Supported_USB_Version : DWORD;
    END;
    USBFN_BUS_CONFIGURATION_INFO = RECORD
        ConfigurationName : ARRAY [0..39] OF CHAR;
        IsCurrent : BOOLEAN;
        IsActive : BOOLEAN;
    END;
    USBFN_CLASS_INFORMATION_PACKET = RECORD
        FullSpeedClassInterface : USBFN_CLASS_INTERFACE;
        HighSpeedClassInterface : USBFN_CLASS_INTERFACE;
        InterfaceName : ARRAY [0..39] OF CHAR;
        InterfaceGuid : ARRAY [0..38] OF CHAR;
        HasInterfaceGuid : BOOLEAN;
        SuperSpeedClassInterface : USBFN_CLASS_INTERFACE;
    END;
    USBFN_CLASS_INFORMATION_PACKET_EX = RECORD
        FullSpeedClassInterfaceEx : USBFN_CLASS_INTERFACE_EX;
        HighSpeedClassInterfaceEx : USBFN_CLASS_INTERFACE_EX;
        SuperSpeedClassInterfaceEx : USBFN_CLASS_INTERFACE_EX;
        InterfaceName : ARRAY [0..39] OF CHAR;
        InterfaceGuid : ARRAY [0..38] OF CHAR;
        HasInterfaceGuid : BOOLEAN;
    END;
    USBFN_CLASS_INTERFACE = RECORD
        InterfaceNumber : BYTE;
        PipeCount : BYTE;
        PipeArr : ARRAY [0..191] OF BYTE;
    END;
    USBFN_CLASS_INTERFACE_EX = RECORD
        BaseInterfaceNumber : BYTE;
        InterfaceCount : BYTE;
        PipeCount : BYTE;
        PipeArr : ARRAY [0..191] OF BYTE;
    END;
    USBFN_INTERFACE_INFO = RECORD
        InterfaceNumber : BYTE;
        Speed : INTEGER32;
        Size : WORD;
        InterfaceDescriptorSet : ARRAY [0..1] OF BYTE;
    END;
    USBFN_NOTIFICATION = RECORD
        Event : INTEGER32;
        u : ADDRESS;
    END;
    USBFN_PIPE_INFORMATION = RECORD
        EpDesc : USB_ENDPOINT_DESCRIPTOR;
        PipeId : DWORD;
    END;
    USBFN_USB_STRING = RECORD
        StringIndex : BYTE;
        UsbString : ARRAY [0..254] OF CHAR;
    END;
    USBSCAN_GET_DESCRIPTOR = RECORD
        DescriptorType : BYTE;
        Index : BYTE;
        LanguageId : WORD;
    END;
    USBSCAN_PIPE_CONFIGURATION = RECORD
        NumberOfPipes : DWORD;
        PipeInfo : ARRAY [0..63] OF BYTE;
    END;
    USBSCAN_PIPE_INFORMATION = RECORD
        MaximumPacketSize : WORD;
        EndpointAddress : BYTE;
        Interval : BYTE;
        PipeType : INTEGER32;
    END;
    USBSCAN_TIMEOUT = RECORD
        TimeoutRead : DWORD;
        TimeoutWrite : DWORD;
        TimeoutEvent : DWORD;
    END;
    USBUSER_BANDWIDTH_INFO_REQUEST = RECORD
        Header : USBUSER_REQUEST_HEADER;
        BandwidthInformation : USB_BANDWIDTH_INFO;
    END;
    USBUSER_BUS_STATISTICS_0_REQUEST = RECORD
        Header : USBUSER_REQUEST_HEADER;
        BusStatistics0 : USB_BUS_STATISTICS_0;
    END;
    USBUSER_CLOSE_RAW_DEVICE = RECORD
        Header : USBUSER_REQUEST_HEADER;
        Parameters : USB_CLOSE_RAW_DEVICE_PARAMETERS;
    END;
    USBUSER_CONTROLLER_INFO_0 = RECORD
        Header : USBUSER_REQUEST_HEADER;
        Info0 : USB_CONTROLLER_INFO_0;
    END;
    USBUSER_CONTROLLER_UNICODE_NAME = RECORD
        Header : USBUSER_REQUEST_HEADER;
        UnicodeName : USB_UNICODE_NAME;
    END;
    USBUSER_GET_DRIVER_VERSION = RECORD
        Header : USBUSER_REQUEST_HEADER;
        Parameters : USB_DRIVER_VERSION_PARAMETERS;
    END;
    USBUSER_GET_USB2HW_VERSION = RECORD
        Header : USBUSER_REQUEST_HEADER;
        Parameters : USB_USB2HW_VERSION_PARAMETERS;
    END;
    USBUSER_OPEN_RAW_DEVICE = RECORD
        Header : USBUSER_REQUEST_HEADER;
        Parameters : USB_OPEN_RAW_DEVICE_PARAMETERS;
    END;
    USBUSER_PASS_THRU_REQUEST = RECORD
        Header : USBUSER_REQUEST_HEADER;
        PassThru : USB_PASS_THRU_PARAMETERS;
    END;
    USBUSER_POWER_INFO_REQUEST = RECORD
        Header : USBUSER_REQUEST_HEADER;
        PowerInformation : USB_POWER_INFO;
    END;
    USBUSER_RAW_RESET_ROOT_PORT = RECORD
        Header : USBUSER_REQUEST_HEADER;
        Parameters : RAW_RESET_PORT_PARAMETERS;
    END;
    USBUSER_REFRESH_HCT_REG = RECORD
        Header : USBUSER_REQUEST_HEADER;
        Flags : DWORD;
    END;
    USBUSER_REQUEST_HEADER = RECORD
        UsbUserRequest : DWORD;
        UsbUserStatusCode : INTEGER32;
        RequestBufferLength : DWORD;
        ActualBufferLength : DWORD;
    END;
    USBUSER_ROOTPORT_FEATURE_REQUEST = RECORD
        Header : USBUSER_REQUEST_HEADER;
        Parameters : RAW_ROOTPORT_FEATURE;
    END;
    USBUSER_ROOTPORT_PARAMETERS = RECORD
        Header : USBUSER_REQUEST_HEADER;
        Parameters : RAW_ROOTPORT_PARAMETERS;
    END;
    USBUSER_SEND_ONE_PACKET = RECORD
        Header : USBUSER_REQUEST_HEADER;
        PacketParameters : PACKET_PARAMETERS;
    END;
    USBUSER_SEND_RAW_COMMAND = RECORD
        Header : USBUSER_REQUEST_HEADER;
        Parameters : USB_SEND_RAW_COMMAND_PARAMETERS;
    END;
    USB_20_PORT_CHANGE;
    USB_20_PORT_STATUS;
    USB_30_HUB_DESCRIPTOR = RECORD
        bLength : BYTE;
        bDescriptorType : BYTE;
        bNumberOfPorts : BYTE;
        wHubCharacteristics : WORD;
        bPowerOnToPowerGood : BYTE;
        bHubControlCurrent : BYTE;
        bHubHdrDecLat : BYTE;
        wHubDelay : WORD;
        DeviceRemovable : WORD;
    END;
    USB_30_PORT_CHANGE;
    USB_30_PORT_STATUS;
    USB_ACQUIRE_INFO = RECORD
        NotificationType : INTEGER32;
        TotalSize : DWORD;
        Buffer : ARRAY [0..1] OF CHAR;
    END;
    USB_BANDWIDTH_INFO = RECORD
        DeviceCount : DWORD;
        TotalBusBandwidth : DWORD;
        Total32secBandwidth : DWORD;
        AllocedBulkAndControl : DWORD;
        AllocedIso : DWORD;
        AllocedInterrupt_1ms : DWORD;
        AllocedInterrupt_2ms : DWORD;
        AllocedInterrupt_4ms : DWORD;
        AllocedInterrupt_8ms : DWORD;
        AllocedInterrupt_16ms : DWORD;
        AllocedInterrupt_32ms : DWORD;
    END;
    USB_BOS_DESCRIPTOR = RECORD
        bLength : BYTE;
        bDescriptorType : BYTE;
        wTotalLength : WORD;
        bNumDeviceCaps : BYTE;
    END;
    USB_BUS_NOTIFICATION = RECORD
        NotificationType : INTEGER32;
        TotalBandwidth : DWORD;
        ConsumedBandwidth : DWORD;
        ControllerNameLength : DWORD;
    END;
    USB_BUS_STATISTICS_0 = RECORD
        DeviceCount : DWORD;
        CurrentSystemTime : INTEGER64;
        CurrentUsbFrame : DWORD;
        BulkBytes : DWORD;
        IsoBytes : DWORD;
        InterruptBytes : DWORD;
        ControlDataBytes : DWORD;
        PciInterruptCount : DWORD;
        HardResetCount : DWORD;
        WorkerSignalCount : DWORD;
        CommonBufferBytes : DWORD;
        WorkerIdleTimeMs : DWORD;
        RootHubEnabled : BOOLEAN;
        RootHubDevicePowerState : BYTE;
        Unused : BYTE;
        NameIndex : BYTE;
    END;
    USB_CHANGE_REGISTRATION_HANDLE = RECORD
        Value : ADDRESS;
    END;
    USB_CLOSE_RAW_DEVICE_PARAMETERS = RECORD
        xxx : DWORD;
    END;
    USB_COMMON_DESCRIPTOR = RECORD
        bLength : BYTE;
        bDescriptorType : BYTE;
    END;
    USB_COMPOSITE_DEVICE_INFO = RECORD
        DeviceDescriptor : USB_DEVICE_DESCRIPTOR;
        CurrentConfigDescriptor : USB_CONFIGURATION_DESCRIPTOR;
        CurrentConfigurationValue : BYTE;
        NumberOfFunctions : BYTE;
        FunctionInfo : ARRAY [0..3] OF BYTE;
    END;
    USB_COMPOSITE_FUNCTION_INFO = RECORD
        FunctionNumber : BYTE;
        BaseInterfaceNumber : BYTE;
        NumberOfInterfaces : BYTE;
        FunctionIsIdle : BOOLEAN;
    END;
    USB_CONFIGURATION_DESCRIPTOR = RECORD
        bLength : BYTE;
        bDescriptorType : BYTE;
        wTotalLength : WORD;
        bNumInterfaces : BYTE;
        bConfigurationValue : BYTE;
        iConfiguration : BYTE;
        bmAttributes : BYTE;
        MaxPower : BYTE;
    END;
    USB_CONFIGURATION_POWER_DESCRIPTOR = RECORD
        bLength : BYTE;
        bDescriptorType : BYTE;
        SelfPowerConsumedD0 : ARRAY [0..2] OF BYTE;
        bPowerSummaryId : BYTE;
        bBusPowerSavingD1 : BYTE;
        bSelfPowerSavingD1 : BYTE;
        bBusPowerSavingD2 : BYTE;
        bSelfPowerSavingD2 : BYTE;
        bBusPowerSavingD3 : BYTE;
        bSelfPowerSavingD3 : BYTE;
        TransitionTimeFromD1 : WORD;
        TransitionTimeFromD2 : WORD;
        TransitionTimeFromD3 : WORD;
    END;
    USB_CONNECTION_NOTIFICATION = RECORD
        NotificationType : INTEGER32;
        ConnectionNumber : DWORD;
        RequestedBandwidth : DWORD;
        EnumerationFailReason : DWORD;
        PowerRequested : DWORD;
        HubNameLength : DWORD;
    END;
    USB_CONTROLLER_DEVICE_INFO = RECORD
        PciVendorId : DWORD;
        PciDeviceId : DWORD;
        PciRevision : DWORD;
        NumberOfRootPorts : DWORD;
        HcFeatureFlags : DWORD;
    END;
    USB_CONTROLLER_INFO_0 = RECORD
        PciVendorId : DWORD;
        PciDeviceId : DWORD;
        PciRevision : DWORD;
        NumberOfRootPorts : DWORD;
        ControllerFlavor : INTEGER32;
        HcFeatureFlags : DWORD;
    END;
    USB_CYCLE_PORT_PARAMS = RECORD
        ConnectionIndex : DWORD;
        StatusReturned : DWORD;
    END;
    USB_DEFAULT_PIPE_SETUP_PACKET = RECORD
        bmRequestType : BM_REQUEST_TYPE;
        bRequest : BYTE;
        wValue : ADDRESS;
        wIndex : ADDRESS;
        wLength : WORD;
    END;
    USB_DESCRIPTOR_REQUEST = RECORD
        ConnectionIndex : DWORD;
        SetupPacket : ADDRESS;
        Data : ARRAY [0..3] OF BYTE;
    END;
    USB_DEVICE_CAPABILITY_BILLBOARD_DESCRIPTOR = RECORD
        bLength : BYTE;
        bDescriptorType : BYTE;
        bDevCapabilityType : BYTE;
        iAddtionalInfoURL : BYTE;
        bNumberOfAlternateModes : BYTE;
        bPreferredAlternateMode : BYTE;
        VconnPower : ADDRESS;
        bmConfigured : ARRAY [0..31] OF BYTE;
        bReserved : DWORD;
        AlternateMode : ARRAY [0..31] OF BYTE;
    END;
    USB_DEVICE_CAPABILITY_CONTAINER_ID_DESCRIPTOR = RECORD
        bLength : BYTE;
        bDescriptorType : BYTE;
        bDevCapabilityType : BYTE;
        bReserved : BYTE;
        ContainerID : ARRAY [0..15] OF BYTE;
    END;
    USB_DEVICE_CAPABILITY_DESCRIPTOR = RECORD
        bLength : BYTE;
        bDescriptorType : BYTE;
        bDevCapabilityType : BYTE;
    END;
    USB_DEVICE_CAPABILITY_FIRMWARE_STATUS_DESCRIPTOR = RECORD
        bLength : BYTE;
        bDescriptorType : BYTE;
        bDevCapabilityType : BYTE;
        bcdDescriptorVersion : BYTE;
        bmAttributes : ADDRESS;
    END;
    USB_DEVICE_CAPABILITY_PD_CONSUMER_PORT_DESCRIPTOR = RECORD
        bLength : BYTE;
        bDescriptorType : BYTE;
        bDevCapabilityType : BYTE;
        bReserved : BYTE;
        bmCapabilities : ADDRESS;
        wMinVoltage : WORD;
        wMaxVoltage : WORD;
        wReserved : WORD;
        dwMaxOperatingPower : DWORD;
        dwMaxPeakPower : DWORD;
        dwMaxPeakPowerTime : DWORD;
    END;
    USB_DEVICE_CAPABILITY_PLATFORM_DESCRIPTOR = RECORD
        bLength : BYTE;
        bDescriptorType : BYTE;
        bDevCapabilityType : BYTE;
        bReserved : BYTE;
        PlatformCapabilityUuid : GUID;
        CapabililityData : ARRAY [0..7] OF BYTE;
    END;
    USB_DEVICE_CAPABILITY_POWER_DELIVERY_DESCRIPTOR = RECORD
        bLength : BYTE;
        bDescriptorType : BYTE;
        bDevCapabilityType : BYTE;
        bReserved : BYTE;
        bmAttributes : ADDRESS;
        bmProviderPorts : WORD;
        bmConsumerPorts : WORD;
        bcdBCVersion : WORD;
        bcdPDVersion : WORD;
        bcdUSBTypeCVersion : WORD;
    END;
    USB_DEVICE_CAPABILITY_SUPERSPEEDPLUS_SPEED;
    USB_DEVICE_CAPABILITY_SUPERSPEEDPLUS_USB_DESCRIPTOR = RECORD
        bLength : BYTE;
        bDescriptorType : BYTE;
        bDevCapabilityType : BYTE;
        bReserved : BYTE;
        bmAttributes : ADDRESS;
        wFunctionalitySupport : ADDRESS;
        wReserved : WORD;
        bmSublinkSpeedAttr : ARRAY [0..31] OF BYTE;
    END;
    USB_DEVICE_CAPABILITY_SUPERSPEED_USB_DESCRIPTOR = RECORD
        bLength : BYTE;
        bDescriptorType : BYTE;
        bDevCapabilityType : BYTE;
        bmAttributes : BYTE;
        wSpeedsSupported : WORD;
        bFunctionalitySupport : BYTE;
        bU1DevExitLat : BYTE;
        wU2DevExitLat : WORD;
    END;
    USB_DEVICE_CAPABILITY_USB20_EXTENSION_DESCRIPTOR = RECORD
        bLength : BYTE;
        bDescriptorType : BYTE;
        bDevCapabilityType : BYTE;
        bmAttributes : ADDRESS;
    END;
    USB_DEVICE_CHARACTERISTICS = RECORD
        Version : DWORD;
        Reserved : ARRAY [0..1] OF DWORD;
        UsbDeviceCharacteristicsFlags : DWORD;
        MaximumSendPathDelayInMilliSeconds : DWORD;
        MaximumCompletionPathDelayInMilliSeconds : DWORD;
    END;
    USB_DEVICE_DESCRIPTOR = RECORD
        bLength : BYTE;
        bDescriptorType : BYTE;
        bcdUSB : WORD;
        bDeviceClass : BYTE;
        bDeviceSubClass : BYTE;
        bDeviceProtocol : BYTE;
        bMaxPacketSize0 : BYTE;
        idVendor : WORD;
        idProduct : WORD;
        bcdDevice : WORD;
        iManufacturer : BYTE;
        iProduct : BYTE;
        iSerialNumber : BYTE;
        bNumConfigurations : BYTE;
    END;
    USB_DEVICE_INFO = RECORD
        DeviceState : USB_DEVICE_STATE;
        PortNumber : WORD;
        DeviceDescriptor : USB_DEVICE_DESCRIPTOR;
        CurrentConfigurationValue : BYTE;
        Speed : INTEGER32;
        DeviceAddress : WORD;
        ConnectionIndex : DWORD;
        ConnectionStatus : INTEGER32;
        PnpHardwareId : ARRAY [0..127] OF CHAR;
        PnpCompatibleId : ARRAY [0..127] OF CHAR;
        SerialNumberId : ARRAY [0..127] OF CHAR;
        PnpDeviceDescription : ARRAY [0..127] OF CHAR;
        NumberOfOpenPipes : DWORD;
        PipeList : ARRAY [0..11] OF BYTE;
    END;
    USB_DEVICE_NODE_INFO = RECORD
        Sig : DWORD;
        LengthInBytes : DWORD;
        DeviceDescription : ARRAY [0..39] OF CHAR;
        NodeType : INTEGER32;
        BusAddress : USB_TOPOLOGY_ADDRESS;
        Anonymous : ADDRESS;
    END;
    USB_DEVICE_PERFORMANCE_INFO = RECORD
        BulkBytes : DWORD;
        ControlDataBytes : DWORD;
        IsoBytes : DWORD;
        InterruptBytes : DWORD;
        BulkUrbCount : DWORD;
        ControlUrbCount : DWORD;
        IsoUrbCount : DWORD;
        InterruptUrbCount : DWORD;
        AllocedInterrupt : ARRAY [0..5] OF DWORD;
        AllocedIso : DWORD;
        Total32secBandwidth : DWORD;
        TotalTtBandwidth : DWORD;
        DeviceDescription : ARRAY [0..59] OF CHAR;
        DeviceSpeed : INTEGER32;
        TotalIsoLatency : DWORD;
        DroppedIsoPackets : DWORD;
        TransferErrors : DWORD;
        PciInterruptCount : DWORD;
        HcIdleState : DWORD;
        HcAsyncIdleState : DWORD;
        HcAsyncCacheFlushCount : DWORD;
        HcPeriodicIdleState : DWORD;
        HcPeriodicCacheFlushCount : DWORD;
    END;
    USB_DEVICE_QUALIFIER_DESCRIPTOR = RECORD
        bLength : BYTE;
        bDescriptorType : BYTE;
        bcdUSB : WORD;
        bDeviceClass : BYTE;
        bDeviceSubClass : BYTE;
        bDeviceProtocol : BYTE;
        bMaxPacketSize0 : BYTE;
        bNumConfigurations : BYTE;
        bReserved : BYTE;
    END;
    USB_DEVICE_STATE = RECORD
        _bitfield : DWORD;
    END;
    USB_DEVICE_STATUS;
    USB_DRIVER_VERSION_PARAMETERS = RECORD
        DriverTrackingCode : DWORD;
        USBDI_Version : DWORD;
        USBUSER_Version : DWORD;
        CheckedPortDriver : BOOLEAN;
        CheckedMiniportDriver : BOOLEAN;
        USB_Version : WORD;
    END;
    USB_ENDPOINT_DESCRIPTOR = RECORD
        bLength : BYTE;
        bDescriptorType : BYTE;
        bEndpointAddress : BYTE;
        bmAttributes : BYTE;
        wMaxPacketSize : WORD;
        bInterval : BYTE;
    END;
    USB_ENDPOINT_STATUS;
    USB_FRAME_NUMBER_AND_QPC_FOR_TIME_SYNC_INFORMATION = RECORD
        TimeTrackingHandle : HANDLE;
        InputFrameNumber : DWORD;
        InputMicroFrameNumber : DWORD;
        QueryPerformanceCounterAtInputFrameOrMicroFrame : INTEGER64;
        QueryPerformanceCounterFrequency : INTEGER64;
        PredictedAccuracyInMicroSeconds : DWORD;
        CurrentGenerationID : DWORD;
        CurrentQueryPerformanceCounter : INTEGER64;
        CurrentHardwareFrameNumber : DWORD;
        CurrentHardwareMicroFrameNumber : DWORD;
        CurrentUSBFrameNumber : DWORD;
    END;
    USB_FUNCTION_SUSPEND_OPTIONS;
    USB_HCD_DRIVERKEY_NAME = RECORD
        ActualLength : DWORD;
        DriverKeyName : ARRAY [0..1] OF CHAR;
    END;
    USB_HIGH_SPEED_MAXPACKET;
    USB_HUB_30_PORT_REMOTE_WAKE_MASK;
    USB_HUB_CAPABILITIES = RECORD
        _bitfield : DWORD;
    END;
    USB_HUB_CAPABILITIES_EX = RECORD
        CapabilityFlags : USB_HUB_CAP_FLAGS;
    END;
    USB_HUB_CAP_FLAGS;
    USB_HUB_CHANGE;
    USB_HUB_DESCRIPTOR = RECORD
        bDescriptorLength : BYTE;
        bDescriptorType : BYTE;
        bNumberOfPorts : BYTE;
        wHubCharacteristics : WORD;
        bPowerOnToPowerGood : BYTE;
        bHubControlCurrent : BYTE;
        bRemoveAndPowerMask : ARRAY [0..63] OF BYTE;
    END;
    USB_HUB_DEVICE_INFO = RECORD
        HubDescriptor : USB_HUB_DESCRIPTOR;
        HubNumber : DWORD;
        DeviceAddress : WORD;
        HubIsSelfPowered : BOOLEAN;
        HubIsRootHub : BOOLEAN;
        HubCapabilities : USB_HUB_CAPABILITIES;
        NumberOfHubPorts : DWORD;
        PortInfo : ARRAY [0..15] OF BYTE;
    END;
    USB_HUB_DEVICE_UXD_SETTINGS = RECORD
        Version : DWORD;
        PnpGuid : GUID;
        OwnerGuid : GUID;
        DeleteOnShutdown : DWORD;
        DeleteOnReload : DWORD;
        DeleteOnDisconnect : DWORD;
        Reserved : ARRAY [0..4] OF DWORD;
    END;
    USB_HUB_INFORMATION = RECORD
        HubDescriptor : USB_HUB_DESCRIPTOR;
        HubIsBusPowered : BOOLEAN;
    END;
    USB_HUB_INFORMATION_EX = RECORD
        HubType : INTEGER32;
        HighestPortNumber : WORD;
        u : ADDRESS;
    END;
    USB_HUB_NAME = RECORD
        ActualLength : DWORD;
        HubName : ARRAY [0..1] OF CHAR;
    END;
    USB_HUB_PORT_INFORMATION = RECORD
        DeviceState : USB_DEVICE_STATE;
        PortNumber : WORD;
        DeviceAddress : WORD;
        ConnectionIndex : DWORD;
        ConnectionStatus : INTEGER32;
    END;
    USB_HUB_STATUS;
    USB_HUB_STATUS_AND_CHANGE;
    USB_IDLE_CALLBACK_INFO = RECORD
        IdleCallback : ADDRESS;
        IdleContext : ADDRESS;
    END;
    USB_ID_STRING = RECORD
        LanguageId : WORD;
        Pad : WORD;
        LengthInBytes : DWORD;
        Buffer : PWSTR;
    END;
    USB_INTERFACE_ASSOCIATION_DESCRIPTOR = RECORD
        bLength : BYTE;
        bDescriptorType : BYTE;
        bFirstInterface : BYTE;
        bInterfaceCount : BYTE;
        bFunctionClass : BYTE;
        bFunctionSubClass : BYTE;
        bFunctionProtocol : BYTE;
        iFunction : BYTE;
    END;
    USB_INTERFACE_DESCRIPTOR = RECORD
        bLength : BYTE;
        bDescriptorType : BYTE;
        bInterfaceNumber : BYTE;
        bAlternateSetting : BYTE;
        bNumEndpoints : BYTE;
        bInterfaceClass : BYTE;
        bInterfaceSubClass : BYTE;
        bInterfaceProtocol : BYTE;
        iInterface : BYTE;
    END;
    USB_INTERFACE_POWER_DESCRIPTOR = RECORD
        bLength : BYTE;
        bDescriptorType : BYTE;
        bmCapabilitiesFlags : BYTE;
        bBusPowerSavingD1 : BYTE;
        bSelfPowerSavingD1 : BYTE;
        bBusPowerSavingD2 : BYTE;
        bSelfPowerSavingD2 : BYTE;
        bBusPowerSavingD3 : BYTE;
        bSelfPowerSavingD3 : BYTE;
        TransitionTimeFromD1 : WORD;
        TransitionTimeFromD2 : WORD;
        TransitionTimeFromD3 : WORD;
    END;
    USB_INTERFACE_STATUS;
    USB_MI_PARENT_INFORMATION = RECORD
        NumberOfInterfaces : DWORD;
    END;
    USB_NODE_CONNECTION_ATTRIBUTES = RECORD
        ConnectionIndex : DWORD;
        ConnectionStatus : INTEGER32;
        PortAttributes : DWORD;
    END;
    USB_NODE_CONNECTION_DRIVERKEY_NAME = RECORD
        ConnectionIndex : DWORD;
        ActualLength : DWORD;
        DriverKeyName : ARRAY [0..1] OF CHAR;
    END;
    USB_NODE_CONNECTION_INFORMATION = RECORD
        ConnectionIndex : DWORD;
        DeviceDescriptor : USB_DEVICE_DESCRIPTOR;
        CurrentConfigurationValue : BYTE;
        LowSpeed : BOOLEAN;
        DeviceIsHub : BOOLEAN;
        DeviceAddress : WORD;
        NumberOfOpenPipes : DWORD;
        ConnectionStatus : INTEGER32;
        PipeList : ARRAY [0..11] OF BYTE;
    END;
    USB_NODE_CONNECTION_INFORMATION_EX = RECORD
        ConnectionIndex : DWORD;
        DeviceDescriptor : USB_DEVICE_DESCRIPTOR;
        CurrentConfigurationValue : BYTE;
        Speed : BYTE;
        DeviceIsHub : BOOLEAN;
        DeviceAddress : WORD;
        NumberOfOpenPipes : DWORD;
        ConnectionStatus : INTEGER32;
        PipeList : ARRAY [0..11] OF BYTE;
    END;
    USB_NODE_CONNECTION_INFORMATION_EX_V2 = RECORD
        ConnectionIndex : DWORD;
        Length : DWORD;
        SupportedUsbProtocols : USB_PROTOCOLS;
        Flags : USB_NODE_CONNECTION_INFORMATION_EX_V2_FLAGS;
    END;
    USB_NODE_CONNECTION_INFORMATION_EX_V2_FLAGS;
    USB_NODE_CONNECTION_NAME = RECORD
        ConnectionIndex : DWORD;
        ActualLength : DWORD;
        NodeName : ARRAY [0..1] OF CHAR;
    END;
    USB_NODE_CONNECTION_SUPERSPEEDPLUS_INFORMATION = RECORD
        ConnectionIndex : DWORD;
        Length : DWORD;
        RxSuperSpeedPlus : USB_DEVICE_CAPABILITY_SUPERSPEEDPLUS_SPEED;
        RxLaneCount : DWORD;
        TxSuperSpeedPlus : USB_DEVICE_CAPABILITY_SUPERSPEEDPLUS_SPEED;
        TxLaneCount : DWORD;
    END;
    USB_NODE_INFORMATION = RECORD
        NodeType : INTEGER32;
        u : ADDRESS;
    END;
    USB_NOTIFICATION = RECORD
        NotificationType : INTEGER32;
    END;
    USB_OPEN_RAW_DEVICE_PARAMETERS = RECORD
        PortStatus : WORD;
        MaxPacketEp0 : WORD;
    END;
    USB_PASS_THRU_PARAMETERS = RECORD
        FunctionGUID : GUID;
        ParameterLength : DWORD;
        Parameters : ARRAY [0..3] OF BYTE;
    END;
    USB_PIPE_INFO = RECORD
        EndpointDescriptor : USB_ENDPOINT_DESCRIPTOR;
        ScheduleOffset : DWORD;
    END;
    USB_PORT_CHANGE;
    USB_PORT_CONNECTOR_PROPERTIES = RECORD
        ConnectionIndex : DWORD;
        ActualLength : DWORD;
        UsbPortProperties : USB_PORT_PROPERTIES;
        CompanionIndex : WORD;
        CompanionPortNumber : WORD;
        CompanionHubSymbolicLinkName : ARRAY [0..1] OF CHAR;
    END;
    USB_PORT_EXT_STATUS;
    USB_PORT_EXT_STATUS_AND_CHANGE;
    USB_PORT_PROPERTIES;
    USB_PORT_STATUS;
    USB_PORT_STATUS_AND_CHANGE;
    USB_POWER_INFO = RECORD
        SystemState : INTEGER32;
        HcDevicePowerState : INTEGER32;
        HcDeviceWake : INTEGER32;
        HcSystemWake : INTEGER32;
        RhDevicePowerState : INTEGER32;
        RhDeviceWake : INTEGER32;
        RhSystemWake : INTEGER32;
        LastSystemSleepState : INTEGER32;
        CanWakeup : BOOLEAN;
        IsPowered : BOOLEAN;
    END;
    USB_PROTOCOLS;
    USB_ROOT_HUB_NAME = RECORD
        ActualLength : DWORD;
        RootHubName : ARRAY [0..1] OF CHAR;
    END;
    USB_SEND_RAW_COMMAND_PARAMETERS = RECORD
        Usb_bmRequest : BYTE;
        Usb_bRequest : BYTE;
        Usb_wVlaue : WORD;
        Usb_wIndex : WORD;
        Usb_wLength : WORD;
        DeviceAddress : WORD;
        MaximumPacketSize : WORD;
        Timeout : DWORD;
        DataLength : DWORD;
        UsbdStatusCode : INTEGER32;
        Data : ARRAY [0..3] OF BYTE;
    END;
    USB_START_TRACKING_FOR_TIME_SYNC_INFORMATION = RECORD
        TimeTrackingHandle : HANDLE;
        IsStartupDelayTolerable : BOOLEAN;
    END;
    USB_STOP_TRACKING_FOR_TIME_SYNC_INFORMATION = RECORD
        TimeTrackingHandle : HANDLE;
    END;
    USB_STRING_DESCRIPTOR = RECORD
        bLength : BYTE;
        bDescriptorType : BYTE;
        bString : ARRAY [0..0] OF CHAR;
    END;
    USB_SUPERSPEEDPLUS_ISOCH_ENDPOINT_COMPANION_DESCRIPTOR = RECORD
        bLength : BYTE;
        bDescriptorType : BYTE;
        wReserved : WORD;
        dwBytesPerInterval : DWORD;
    END;
    USB_SUPERSPEED_ENDPOINT_COMPANION_DESCRIPTOR = RECORD
        bLength : BYTE;
        bDescriptorType : BYTE;
        bMaxBurst : BYTE;
        bmAttributes : ADDRESS;
        wBytesPerInterval : WORD;
    END;
    USB_TOPOLOGY_ADDRESS = RECORD
        PciBusNumber : DWORD;
        PciDeviceNumber : DWORD;
        PciFunctionNumber : DWORD;
        Reserved : DWORD;
        RootHubPortNumber : WORD;
        HubPortNumber : ARRAY [0..4] OF WORD;
        Reserved2 : WORD;
    END;
    USB_TRANSPORT_CHARACTERISTICS = RECORD
        Version : DWORD;
        TransportCharacteristicsFlags : DWORD;
        CurrentRoundtripLatencyInMilliSeconds : QWORD;
        MaxPotentialBandwidth : QWORD;
    END;
    USB_TRANSPORT_CHARACTERISTICS_CHANGE_NOTIFICATION = RECORD
        Handle : USB_CHANGE_REGISTRATION_HANDLE;
        UsbTransportCharacteristics : USB_TRANSPORT_CHARACTERISTICS;
    END;
    USB_TRANSPORT_CHARACTERISTICS_CHANGE_REGISTRATION = RECORD
        ChangeNotificationInputFlags : DWORD;
        Handle : USB_CHANGE_REGISTRATION_HANDLE;
        UsbTransportCharacteristics : USB_TRANSPORT_CHARACTERISTICS;
    END;
    USB_TRANSPORT_CHARACTERISTICS_CHANGE_UNREGISTRATION = RECORD
        Handle : USB_CHANGE_REGISTRATION_HANDLE;
    END;
    USB_UNICODE_NAME = RECORD
        Length : DWORD;
        String : ARRAY [0..1] OF CHAR;
    END;
    USB_USB2HW_VERSION_PARAMETERS = RECORD
        Usb2HwRevision : BYTE;
    END;
    WINUSB_INTERFACE_HANDLE = RECORD
        Value : ADDRESS;
    END;
    WINUSB_PIPE_INFORMATION = RECORD
        PipeType : INTEGER32;
        PipeId : BYTE;
        MaximumPacketSize : WORD;
        Interval : BYTE;
    END;
    WINUSB_PIPE_INFORMATION_EX = RECORD
        PipeType : INTEGER32;
        PipeId : BYTE;
        MaximumPacketSize : WORD;
        Interval : BYTE;
        MaximumBytesPerInterval : DWORD;
    END;
    WINUSB_SETUP_PACKET = RECORD
        RequestType : BYTE;
        Request : BYTE;
        Value : WORD;
        Index : WORD;
        Length : WORD;
    END;
    _URB_BULK_OR_INTERRUPT_TRANSFER = RECORD
        Hdr : _URB_HEADER;
        PipeHandle : ADDRESS;
        TransferFlags : DWORD;
        TransferBufferLength : DWORD;
        TransferBuffer : ADDRESS;
        TransferBufferMDL : ADDRESS;
        UrbLink : POINTER TO URB;
        hca : _URB_HCD_AREA;
    END;
    _URB_CONTROL_DESCRIPTOR_REQUEST = RECORD
        Hdr : _URB_HEADER;
        Reserved : ADDRESS;
        Reserved0 : DWORD;
        TransferBufferLength : DWORD;
        TransferBuffer : ADDRESS;
        TransferBufferMDL : ADDRESS;
        UrbLink : POINTER TO URB;
        hca : _URB_HCD_AREA;
        Reserved1 : WORD;
        Index : BYTE;
        DescriptorType : BYTE;
        LanguageId : WORD;
        Reserved2 : WORD;
    END;
    _URB_CONTROL_FEATURE_REQUEST = RECORD
        Hdr : _URB_HEADER;
        Reserved : ADDRESS;
        Reserved2 : DWORD;
        Reserved3 : DWORD;
        Reserved4 : ADDRESS;
        Reserved5 : ADDRESS;
        UrbLink : POINTER TO URB;
        hca : _URB_HCD_AREA;
        Reserved0 : WORD;
        FeatureSelector : WORD;
        Index : WORD;
        Reserved1 : WORD;
    END;
    _URB_CONTROL_GET_CONFIGURATION_REQUEST = RECORD
        Hdr : _URB_HEADER;
        Reserved : ADDRESS;
        Reserved0 : DWORD;
        TransferBufferLength : DWORD;
        TransferBuffer : ADDRESS;
        TransferBufferMDL : ADDRESS;
        UrbLink : POINTER TO URB;
        hca : _URB_HCD_AREA;
        Reserved1 : ARRAY [0..7] OF BYTE;
    END;
    _URB_CONTROL_GET_INTERFACE_REQUEST = RECORD
        Hdr : _URB_HEADER;
        Reserved : ADDRESS;
        Reserved0 : DWORD;
        TransferBufferLength : DWORD;
        TransferBuffer : ADDRESS;
        TransferBufferMDL : ADDRESS;
        UrbLink : POINTER TO URB;
        hca : _URB_HCD_AREA;
        Reserved1 : ARRAY [0..3] OF BYTE;
        Interface : WORD;
        Reserved2 : WORD;
    END;
    _URB_CONTROL_GET_STATUS_REQUEST = RECORD
        Hdr : _URB_HEADER;
        Reserved : ADDRESS;
        Reserved0 : DWORD;
        TransferBufferLength : DWORD;
        TransferBuffer : ADDRESS;
        TransferBufferMDL : ADDRESS;
        UrbLink : POINTER TO URB;
        hca : _URB_HCD_AREA;
        Reserved1 : ARRAY [0..3] OF BYTE;
        Index : WORD;
        Reserved2 : WORD;
    END;
    _URB_CONTROL_TRANSFER = RECORD
        Hdr : _URB_HEADER;
        PipeHandle : ADDRESS;
        TransferFlags : DWORD;
        TransferBufferLength : DWORD;
        TransferBuffer : ADDRESS;
        TransferBufferMDL : ADDRESS;
        UrbLink : POINTER TO URB;
        hca : _URB_HCD_AREA;
        SetupPacket : ARRAY [0..7] OF BYTE;
    END;
    _URB_CONTROL_TRANSFER_EX = RECORD
        Hdr : _URB_HEADER;
        PipeHandle : ADDRESS;
        TransferFlags : DWORD;
        TransferBufferLength : DWORD;
        TransferBuffer : ADDRESS;
        TransferBufferMDL : ADDRESS;
        Timeout : DWORD;
        hca : _URB_HCD_AREA;
        SetupPacket : ARRAY [0..7] OF BYTE;
    END;
    _URB_CONTROL_VENDOR_OR_CLASS_REQUEST = RECORD
        Hdr : _URB_HEADER;
        Reserved : ADDRESS;
        TransferFlags : DWORD;
        TransferBufferLength : DWORD;
        TransferBuffer : ADDRESS;
        TransferBufferMDL : ADDRESS;
        UrbLink : POINTER TO URB;
        hca : _URB_HCD_AREA;
        RequestTypeReservedBits : BYTE;
        Request : BYTE;
        Value : WORD;
        Index : WORD;
        Reserved1 : WORD;
    END;
    _URB_FRAME_LENGTH_CONTROL = RECORD
        Hdr : _URB_HEADER;
    END;
    _URB_GET_CURRENT_FRAME_NUMBER = RECORD
        Hdr : _URB_HEADER;
        FrameNumber : DWORD;
    END;
    _URB_GET_FRAME_LENGTH = RECORD
        Hdr : _URB_HEADER;
        FrameLength : DWORD;
        FrameNumber : DWORD;
    END;
    _URB_GET_ISOCH_PIPE_TRANSFER_PATH_DELAYS = RECORD
        Hdr : _URB_HEADER;
        PipeHandle : ADDRESS;
        MaximumSendPathDelayInMilliSeconds : DWORD;
        MaximumCompletionPathDelayInMilliSeconds : DWORD;
    END;
    _URB_HCD_AREA = RECORD
        Reserved8 : ARRAY [0..7] OF ADDRESS;
    END;
    _URB_HEADER = RECORD
        Length : WORD;
        Function : WORD;
        Status : INTEGER32;
        UsbdDeviceHandle : ADDRESS;
        UsbdFlags : DWORD;
    END;
    _URB_ISOCH_TRANSFER = RECORD
        Hdr : _URB_HEADER;
        PipeHandle : ADDRESS;
        TransferFlags : DWORD;
        TransferBufferLength : DWORD;
        TransferBuffer : ADDRESS;
        TransferBufferMDL : ADDRESS;
        UrbLink : POINTER TO URB;
        hca : _URB_HCD_AREA;
        StartFrame : DWORD;
        NumberOfPackets : DWORD;
        ErrorCount : DWORD;
        IsoPacket : ARRAY [0..11] OF BYTE;
    END;
    _URB_OPEN_STATIC_STREAMS = RECORD
        Hdr : _URB_HEADER;
        PipeHandle : ADDRESS;
        NumberOfStreams : DWORD;
        StreamInfoVersion : WORD;
        StreamInfoSize : WORD;
        Streams : POINTER TO USBD_STREAM_INFORMATION;
    END;
    _URB_OS_FEATURE_DESCRIPTOR_REQUEST = RECORD
        Hdr : _URB_HEADER;
        Reserved : ADDRESS;
        Reserved0 : DWORD;
        TransferBufferLength : DWORD;
        TransferBuffer : ADDRESS;
        TransferBufferMDL : ADDRESS;
        UrbLink : POINTER TO URB;
        hca : _URB_HCD_AREA;
        _bitfield : BYTE;
        Reserved2 : BYTE;
        InterfaceNumber : BYTE;
        MS_PageIndex : BYTE;
        MS_FeatureDescriptorIndex : WORD;
        Reserved3 : WORD;
    END;
    _URB_PIPE_REQUEST = RECORD
        Hdr : _URB_HEADER;
        PipeHandle : ADDRESS;
        Reserved : DWORD;
    END;
    _URB_SELECT_CONFIGURATION = RECORD
        Hdr : _URB_HEADER;
        ConfigurationDescriptor : POINTER TO USB_CONFIGURATION_DESCRIPTOR;
        ConfigurationHandle : ADDRESS;
        Interface : USBD_INTERFACE_INFORMATION;
    END;
    _URB_SELECT_INTERFACE = RECORD
        Hdr : _URB_HEADER;
        ConfigurationHandle : ADDRESS;
        Interface : USBD_INTERFACE_INFORMATION;
    END;
    _URB_SET_FRAME_LENGTH = RECORD
        Hdr : _URB_HEADER;
        FrameLengthDelta : INTEGER32;
    END;

PROCEDURE WinUsb_AbortPipe["WinUsb_AbortPipe" EXTERNAL FROM "WINUSB.dll"](InterfaceHandle : WINUSB_INTERFACE_HANDLE; PipeID : BYTE) : BOOL;
PROCEDURE WinUsb_ControlTransfer["WinUsb_ControlTransfer" EXTERNAL FROM "WINUSB.dll"](InterfaceHandle : WINUSB_INTERFACE_HANDLE; SetupPacket : WINUSB_SETUP_PACKET; Buffer : POINTER TO BYTE; BufferLength : DWORD; LengthTransferred : POINTER TO DWORD; Overlapped : POINTER TO System_IO.OVERLAPPED) : BOOL;
PROCEDURE WinUsb_FlushPipe["WinUsb_FlushPipe" EXTERNAL FROM "WINUSB.dll"](InterfaceHandle : WINUSB_INTERFACE_HANDLE; PipeID : BYTE) : BOOL;
PROCEDURE WinUsb_Free["WinUsb_Free" EXTERNAL FROM "WINUSB.dll"](InterfaceHandle : WINUSB_INTERFACE_HANDLE) : BOOL;
PROCEDURE WinUsb_GetAdjustedFrameNumber["WinUsb_GetAdjustedFrameNumber" EXTERNAL FROM "WINUSB.dll"](CurrentFrameNumber : POINTER TO DWORD; TimeStamp : INTEGER64) : BOOL;
PROCEDURE WinUsb_GetAssociatedInterface["WinUsb_GetAssociatedInterface" EXTERNAL FROM "WINUSB.dll"](InterfaceHandle : WINUSB_INTERFACE_HANDLE; AssociatedInterfaceIndex : BYTE; AssociatedInterfaceHandle : POINTER TO WINUSB_INTERFACE_HANDLE) : BOOL;
PROCEDURE WinUsb_GetCurrentAlternateSetting["WinUsb_GetCurrentAlternateSetting" EXTERNAL FROM "WINUSB.dll"](InterfaceHandle : WINUSB_INTERFACE_HANDLE; SettingNumber : POINTER TO BYTE) : BOOL;
PROCEDURE WinUsb_GetCurrentFrameNumber["WinUsb_GetCurrentFrameNumber" EXTERNAL FROM "WINUSB.dll"](InterfaceHandle : WINUSB_INTERFACE_HANDLE; CurrentFrameNumber : POINTER TO DWORD; TimeStamp : POINTER TO INTEGER64) : BOOL;
PROCEDURE WinUsb_GetCurrentFrameNumberAndQpc["WinUsb_GetCurrentFrameNumberAndQpc" EXTERNAL FROM "WINUSB.dll"](InterfaceHandle : WINUSB_INTERFACE_HANDLE; FrameQpcInfo : POINTER TO USB_FRAME_NUMBER_AND_QPC_FOR_TIME_SYNC_INFORMATION) : BOOL;
PROCEDURE WinUsb_GetDescriptor["WinUsb_GetDescriptor" EXTERNAL FROM "WINUSB.dll"](InterfaceHandle : WINUSB_INTERFACE_HANDLE; DescriptorType : BYTE; Index : BYTE; LanguageID : WORD; Buffer : POINTER TO BYTE; BufferLength : DWORD; LengthTransferred : POINTER TO DWORD) : BOOL;
PROCEDURE WinUsb_GetOverlappedResult["WinUsb_GetOverlappedResult" EXTERNAL FROM "WINUSB.dll"](InterfaceHandle : WINUSB_INTERFACE_HANDLE; lpOverlapped : POINTER TO System_IO.OVERLAPPED; lpNumberOfBytesTransferred : POINTER TO DWORD; bWait : BOOL) : BOOL;
PROCEDURE WinUsb_GetPipePolicy["WinUsb_GetPipePolicy" EXTERNAL FROM "WINUSB.dll"](InterfaceHandle : WINUSB_INTERFACE_HANDLE; PipeID : BYTE; PolicyType : DWORD; ValueLength : POINTER TO DWORD; Value : ADDRESS) : BOOL;
PROCEDURE WinUsb_GetPowerPolicy["WinUsb_GetPowerPolicy" EXTERNAL FROM "WINUSB.dll"](InterfaceHandle : WINUSB_INTERFACE_HANDLE; PolicyType : DWORD; ValueLength : POINTER TO DWORD; Value : ADDRESS) : BOOL;
PROCEDURE WinUsb_Initialize["WinUsb_Initialize" EXTERNAL FROM "WINUSB.dll"](DeviceHandle : HANDLE; InterfaceHandle : POINTER TO WINUSB_INTERFACE_HANDLE) : BOOL;
PROCEDURE WinUsb_ParseConfigurationDescriptor["WinUsb_ParseConfigurationDescriptor" EXTERNAL FROM "WINUSB.dll"](ConfigurationDescriptor : POINTER TO USB_CONFIGURATION_DESCRIPTOR; StartPosition : ADDRESS; InterfaceNumber : INTEGER32; AlternateSetting : INTEGER32; InterfaceClass : INTEGER32; InterfaceSubClass : INTEGER32; InterfaceProtocol : INTEGER32) : POINTER TO USB_INTERFACE_DESCRIPTOR;
PROCEDURE WinUsb_ParseDescriptors["WinUsb_ParseDescriptors" EXTERNAL FROM "WINUSB.dll"](DescriptorBuffer : ADDRESS; TotalLength : DWORD; StartPosition : ADDRESS; DescriptorType : INTEGER32) : POINTER TO USB_COMMON_DESCRIPTOR;
PROCEDURE WinUsb_QueryDeviceInformation["WinUsb_QueryDeviceInformation" EXTERNAL FROM "WINUSB.dll"](InterfaceHandle : WINUSB_INTERFACE_HANDLE; InformationType : DWORD; BufferLength : POINTER TO DWORD; Buffer : ADDRESS) : BOOL;
PROCEDURE WinUsb_QueryInterfaceSettings["WinUsb_QueryInterfaceSettings" EXTERNAL FROM "WINUSB.dll"](InterfaceHandle : WINUSB_INTERFACE_HANDLE; AlternateInterfaceNumber : BYTE; UsbAltInterfaceDescriptor : POINTER TO USB_INTERFACE_DESCRIPTOR) : BOOL;
PROCEDURE WinUsb_QueryPipe["WinUsb_QueryPipe" EXTERNAL FROM "WINUSB.dll"](InterfaceHandle : WINUSB_INTERFACE_HANDLE; AlternateInterfaceNumber : BYTE; PipeIndex : BYTE; PipeInformation : POINTER TO WINUSB_PIPE_INFORMATION) : BOOL;
PROCEDURE WinUsb_QueryPipeEx["WinUsb_QueryPipeEx" EXTERNAL FROM "WINUSB.dll"](InterfaceHandle : WINUSB_INTERFACE_HANDLE; AlternateSettingNumber : BYTE; PipeIndex : BYTE; PipeInformationEx : POINTER TO WINUSB_PIPE_INFORMATION_EX) : BOOL;
PROCEDURE WinUsb_ReadIsochPipe["WinUsb_ReadIsochPipe" EXTERNAL FROM "WINUSB.dll"](BufferHandle : ADDRESS; Offset : DWORD; Length : DWORD; FrameNumber : POINTER TO DWORD; NumberOfPackets : DWORD; IsoPacketDescriptors : POINTER TO USBD_ISO_PACKET_DESCRIPTOR; Overlapped : POINTER TO System_IO.OVERLAPPED) : BOOL;
PROCEDURE WinUsb_ReadIsochPipeAsap["WinUsb_ReadIsochPipeAsap" EXTERNAL FROM "WINUSB.dll"](BufferHandle : ADDRESS; Offset : DWORD; Length : DWORD; ContinueStream : BOOL; NumberOfPackets : DWORD; IsoPacketDescriptors : POINTER TO USBD_ISO_PACKET_DESCRIPTOR; Overlapped : POINTER TO System_IO.OVERLAPPED) : BOOL;
PROCEDURE WinUsb_ReadPipe["WinUsb_ReadPipe" EXTERNAL FROM "WINUSB.dll"](InterfaceHandle : WINUSB_INTERFACE_HANDLE; PipeID : BYTE; Buffer : POINTER TO BYTE; BufferLength : DWORD; LengthTransferred : POINTER TO DWORD; Overlapped : POINTER TO System_IO.OVERLAPPED) : BOOL;
PROCEDURE WinUsb_RegisterIsochBuffer["WinUsb_RegisterIsochBuffer" EXTERNAL FROM "WINUSB.dll"](InterfaceHandle : WINUSB_INTERFACE_HANDLE; PipeID : BYTE; Buffer : POINTER TO BYTE; BufferLength : DWORD; IsochBufferHandle : ADDRESS) : BOOL;
PROCEDURE WinUsb_ResetPipe["WinUsb_ResetPipe" EXTERNAL FROM "WINUSB.dll"](InterfaceHandle : WINUSB_INTERFACE_HANDLE; PipeID : BYTE) : BOOL;
PROCEDURE WinUsb_SetCurrentAlternateSetting["WinUsb_SetCurrentAlternateSetting" EXTERNAL FROM "WINUSB.dll"](InterfaceHandle : WINUSB_INTERFACE_HANDLE; SettingNumber : BYTE) : BOOL;
PROCEDURE WinUsb_SetPipePolicy["WinUsb_SetPipePolicy" EXTERNAL FROM "WINUSB.dll"](InterfaceHandle : WINUSB_INTERFACE_HANDLE; PipeID : BYTE; PolicyType : DWORD; ValueLength : DWORD; Value : ADDRESS) : BOOL;
PROCEDURE WinUsb_SetPowerPolicy["WinUsb_SetPowerPolicy" EXTERNAL FROM "WINUSB.dll"](InterfaceHandle : WINUSB_INTERFACE_HANDLE; PolicyType : DWORD; ValueLength : DWORD; Value : ADDRESS) : BOOL;
PROCEDURE WinUsb_StartTrackingForTimeSync["WinUsb_StartTrackingForTimeSync" EXTERNAL FROM "WINUSB.dll"](InterfaceHandle : WINUSB_INTERFACE_HANDLE; StartTrackingInfo : POINTER TO USB_START_TRACKING_FOR_TIME_SYNC_INFORMATION) : BOOL;
PROCEDURE WinUsb_StopTrackingForTimeSync["WinUsb_StopTrackingForTimeSync" EXTERNAL FROM "WINUSB.dll"](InterfaceHandle : WINUSB_INTERFACE_HANDLE; StopTrackingInfo : POINTER TO USB_STOP_TRACKING_FOR_TIME_SYNC_INFORMATION) : BOOL;
PROCEDURE WinUsb_UnregisterIsochBuffer["WinUsb_UnregisterIsochBuffer" EXTERNAL FROM "WINUSB.dll"](IsochBufferHandle : ADDRESS) : BOOL;
PROCEDURE WinUsb_WriteIsochPipe["WinUsb_WriteIsochPipe" EXTERNAL FROM "WINUSB.dll"](BufferHandle : ADDRESS; Offset : DWORD; Length : DWORD; FrameNumber : POINTER TO DWORD; Overlapped : POINTER TO System_IO.OVERLAPPED) : BOOL;
PROCEDURE WinUsb_WriteIsochPipeAsap["WinUsb_WriteIsochPipeAsap" EXTERNAL FROM "WINUSB.dll"](BufferHandle : ADDRESS; Offset : DWORD; Length : DWORD; ContinueStream : BOOL; Overlapped : POINTER TO System_IO.OVERLAPPED) : BOOL;
PROCEDURE WinUsb_WritePipe["WinUsb_WritePipe" EXTERNAL FROM "WINUSB.dll"](InterfaceHandle : WINUSB_INTERFACE_HANDLE; PipeID : BYTE; Buffer : POINTER TO BYTE; BufferLength : DWORD; LengthTransferred : POINTER TO DWORD; Overlapped : POINTER TO System_IO.OVERLAPPED) : BOOL;

(* types-out summary: 192 types emitted; 716 consts emitted; 34 procedures emitted *)
END Devices_Usb.
